MlsNumber,PublicRemarks,Bathrooms,Bedrooms,InteriorSize,Type,Ammenities,Address,Longitude,Latitude,PostalCode,NeighbourHood,Price,PropertyType,ParkingSpace,OwnershipType,Appliances,FlooringType,BasementType,HeatingType,LandSize,AmmenitiesNearBy,PropertyTax,ZoningDescription,LowResPhoto
"40076537","Welcome to this end unit condo townhouse that feels like a semi-detached!  This home features 3 bedrooms & 3 washrooms & is complete with finished basementmove in ready.  Open concept kitchen with breakfast bar seating offers lots of cupboard & counter space & stainless appliances.  Living room with laminate flooring & sliding door walk-out to large gated deck.  Two piece powder room on main floor.  Master bedroom features 4 piece semi-ensuite & his/her closets.  Broadloom throughout bedrooms.  Finished basement with oversized windows, 4 piece washroom, laundry/storage room & water softener.  Garage access to the inside.  Exclusive parking for 2.  Condo fee $153/month.  Minutes from Conestoga College, parks, schools & Hwy 401.  Will not last! (62966392)","3","3 + 0","1285.0000","Row / Townhouse",,"105 PINNACLE Drive Unit# 94|Kitchener, Ontario N2P1B8","-80.41794975","43.38955764","N2P1B8",,"$649,900 ","Single Family",,"Condominium",,,"Full (Finished)","(Natural gas)",,"Golf Nearby, Place of Worship, Schools",,"Single Family Residential","https://cdn.realtor.ca/listing/TS637505474588300000/reb15/highres/7/40076537_1.jpg"
"40076169","You don't want to miss out on this opportunity of a beautiful town house located in one of the nicest neighborhoods, Doon South. Located close to the 401, public schools and a plaza with everything you need. This is not your standard town house, it comes with more upgrades than we can list: custom kitchen, custom modern tv unit, bedroom built in closets and window bench, fully finished basement with kitchenette, larger windows, additional electric heating, concrete backyard, garage shelving units, to name a few (62963862)","3","3 + 0","1464.0000","Row / Townhouse",,"52 NETHERWOOD Road|Kitchener, Ontario N2P0E4","-80.43487597","43.37273983","N2P0E4",,"$649,000 ","Single Family","3","Condominium","Dishwasher, Dryer, Refrigerator, Stove, Water softener, Washer, Microwave Built-in, Hood Fan, Window Coverings",,"Full (Finished)","(Natural gas)","under 1/2 acre","Park, Playground, Schools, Shopping",,"RES","https://cdn.realtor.ca/listing/TS637504895106100000/reb85/highres/9/40076169_1.jpg"
"X5124506","Beautifully Upgraded Mattamy Freehold Townhouse In The Family-Friendly Community Of Doon South. Kitchen Finished With Oversized Island, Granite Counters, Stainless Steel Appliances And Many Upgrades. Very Functional Layout And Yes!! Absolutely No Condo Fees!! Close To Highway 401, Conestoga College, And Other Amenities.**** EXTRAS **** All Existing Elfs, Stainless Steel Fridge, Stove, Dishwasher, Washer & Dryer, Blinds, Furnace And Air Conditioning. Hot Water Tank (Rental). (27971615)","3","3",,"Row / Townhouse",,"108 WATERMILL ST|Kitchener, Ontario N2P0H3","-80.429085","43.3728338","N2P0H3",,"$719,900 ","Single Family","2","Freehold",,,"N/A (Unfinished)","Forced air (Natural gas)","21.39 x 114.9 FT",,"$3,727.30",,"https://cdn.realtor.ca/listing/TS637496899831300000/reb82/highres/6/x5124506_1.jpg"
"40085352","This beautiful raised bungalow is located minuets away from Conestoga Pkwy, St. Jacobs Farmers Market, schools, shopping, park and more. This home features high ceilings, multiple skylights, vaulted ceilings, bay windows in the lviing room and open concept kitchen. On the main floor you can find 3 bedrooms; a spacious master with an ensuite bathroom, 2 more maple sized bedrooms and 4 pc bath with a quartz countertop and added natural light from a skylight on the top. The large finished basement includes a rec room with wood burning fieplace, one bed room, laundry room, 3 pc bathroom, a cold room, and ample storage space. Outside you can find a large deck and decent size of backyard. On the front, we can see triple car concrete driveway. Windows replaced in 2021, roof replaced in 2017, furnace replaced in 2020, A/C replaced in 2021, residential air cleaner installed in 2020. New installed furnance, A/C, residential air cleaner with 10 years warranty. (63048729)","3","3 + 1","1320.0000","House",,"339 SKYVIEW Place|Waterloo, Ontario N2V1S3","-80.55813282","43.49906197","N2V1S3",,"$719,000 ","Single Family","4","Freehold","Dishwasher, Dryer, Microwave, Refrigerator, Water softener, Washer, Gas stove(s), Window Coverings",,"Full (Finished)","Forced air, (Natural gas)","under 1/2 acre","Park, Playground, Public Transit, Schools, Shopping",,"Residential","https://cdn.realtor.ca/listing/TS637520326039570000/reb16/highres/2/40085352_1.jpg"
"H4101156","Gorgeous 3 Bedroom/2 bathroom with single car garage in mature neighbourhood. This house has been renovated top to bottom in 2013. Carpet free; Hardwood, Ceramics and Parquet all Bedrooms. Gorgeous kitchen with granite countertop, island, glass backsplash, pot and pan drawers, lazy Susan cabinet and 3 new stainless steel appliances. 2 new bathrooms, main with double vanities. All New windows except ones in basement and New Bay window in the living room, upgraded new lighting fixtures, new baseboards throughout, pot lights/dimmer and crown moulding. Walk out to deck through sliders from dining room. New siding. Partially finished basement with New gas fireplace; Walk out to deck, fully fenced backyard,  BBQ gas line (2013), Matures trees and Large wooden shed; New 100 Amp Electrical panel, New Siding (2013), Ample of storage space in the basement;  Our Lady of Lourdes primary school; Walking distance to Resurrection Catholic Secondary School; Close to all amenities. (27061530)","2","3","1251.0000","House",,"7 INADALE Court|Kitchener, Ontario N2M2Z7","-80.536954","43.442423","N2M2Z7",,"$699,900 ","Single Family","3","Freehold","Dishwasher, Dryer, Refrigerator, Stove, Washer & Dryer",,"Full (Finished)","Forced air (Natural gas)","110.45 x 50.02 x 108.41 x 50.12|under 1/2 acre","Public Transit, Schools","$3,255","RESIDENTIAL","https://cdn.realtor.ca/listing/TS637520080780270000/reb14/highres/6/h4101156_1.jpg"
"40084859","Wow! Wow! Wow! This fresh and sunny home is professionally decorated and move-in ready, featuring 9' ceilings on 2 full levels. Located in the highly sought after Mary Allen neighbourhood, and steps from the ION transit, Belmont Village, Vincenzos, Uptown Waterloo, and Iron Horse trail. A small but quaint backyard with little to no maintenance, allows you to come and go as you please, or space for a hot tub to have your own private sanctuary. Roof re-shingled, windows replaced and new plumbing in the last 5 years. A must see! (63045066)","2","3 + 0",,"House",,"235 HERBERT Street|Waterloo, Ontario N2J1V1","-80.51468727","43.4603754","N2J1V1",,"$599,800 ","Single Family",,"Freehold","Dishwasher, Dryer, Refrigerator, Stove, Water softener, Washer, Window Coverings",,"Full (Unfinished)","Forced air, (Natural gas)","under 1/2 acre","Schools, Shopping",,"Residential","https://cdn.realtor.ca/listing/TS637520061440500000/reb16/highres/9/40084859_1.jpg"
"40084582","Built by Carey Homes this stunning Clair Hills home has just about every upgrade offered. The open concept main floor features a Kitchen with Maple Cabinets with under mount lighting, a 7 foot island with Caesar stone quartz waterfall counter top. In the Living room there is a stone clad gas fireplace with an oak mantle. Two sliding doors to the rear yard give the impression of a wall of glass. A formal Dining Room and a 2 piece powder room with floating cabinetry and a vessel sink complete the main floor. Hardwood flooring throughout the main floor. Upstairs the generous Master suite is highlighted by it's spa grade 5 piece En-suite bath, a Walk-in closet with built-ins and a window bench with custom cushion. The second bedroom also has its own 4 piece En-suite. Laundry facilities are also available on the second floor. On the newly finished lower level you will find a large 3rd Bedroom/Rec Room and a 3 piece bath. All top of the line appliances are included. Backs on to zoned Open Space. Excellent school zone and just seconds from all the amenities of the Boardwalk. This home is a must see. (63044649)","4","2 + 1",,"House",,"615 MONTPELLIER DRIVE Drive Unit# B|Waterloo, Ontario N2T0B2","-80.578015","43.448717","N2T0B2",,"$699,000 ","Single Family","2","Freehold","Dishwasher, Dryer, Refrigerator, Water softener, Washer, Range - Gas, Hood Fan, Wine Fridge",,"Full (Finished)","Forced air, (Natural gas)","under 1/2 acre","Public Transit, Schools, Shopping",,"R5","https://cdn.realtor.ca/listing/TS637520025717630000/reb16/highres/2/40084582_1.jpg"
"40081992","Westmount neighbourhood has long been one of the most sought after areas in KW and it isn't hard to see why. Beautiful tree lined streets, character filled homes with large lots, close access to UpTown Waterloo, Westmount Golf and Country Club, excellent schools, and so much more make this community truly special. 201 John Street West offers an opportunity to call Westmount home. This 1,050 square foot raised bungalow is nestled on a mature lot and boasts cherished character and thoughtful updates throughout. An attractive front facade gives a great first impression and upon entering the home you will notice a large foyer and hardwood floors. The spacious front living room is flooded with natural light and showcases a wood burning fireplace and incredible floor to ceiling custom built-in shelves. The entire space feels bright and airy. Your dining area and well appointed kitchen offer an impressive amount of space to entertain, cook, and dine. The dining area includes a large butler style sideboard with upper cabinetry and built-in wine storage. A stunning white kitchen combines both trendy updates and classic touches. A chef's dream, you will find white shaker cabinets, upgraded stainless appliances with gas range, quartz counters, and tiled backsplash. This stylish space flows outdoors to a generous sized raised deck. The master suite includes wall to wall built-in closets and overlooks the rear yard. Make your way to the lower level of this home which includes a large rec room with walk-out, and stunning stone fireplace; expansive laundry suite, 4 piece bathroom, and potential 2nd bedroom/den/home office. A peaceful rear yard awaits with mature trees, vegetable gardens, garden shed, and plenty of privacy. (63035438)","2","1 + 1",,"House",,"201 JOHN Street W|Waterloo, Ontario N2L1C6","-80.52969647","43.45304563","N2L1C6",,"$749,900 ","Single Family","2","Freehold","Dishwasher, Dryer, Refrigerator, Stove, Water softener, Washer, Hood Fan",,"Full (Finished)","Forced air, (Natural gas)","0|under 1/2 acre","Golf Nearby, Park, Place of Worship, Playground, Public Transit, Schools, Shopping",,"RES","https://cdn.realtor.ca/listing/TS637517808912200000/reb16/highres/2/40081992_1.jpg"
"40084054","For Full Details Click More Information - Prime Uptown Waterloo area. Charming legal duplex bungalow. Deep private lot. 5 beds  2 upper, 3 lower. 2-4pc baths. 2 kitchens. 2 laundry. Workshop. Furnace, A/C (2010). Roof (2013). Separate entrances. Dual street access. Parking - 5. Uses - investment, single family or development. Many options. - For Full Details Click More Information (63036162)","2","2 + 3",,"House",,"30 MENNO Street|Waterloo, Ontario N2L2A7","-80.52740904","43.46155479","N2L2A7",,"$699,900 ","Single Family","2","Freehold","Dishwasher, Dryer, Microwave, Refrigerator, Stove, Water softener, Washer, Microwave Built-in",,"Full (Finished)","Forced air","under 1/2 acre","Airport, Golf Nearby, Hospital, Park, Place of Worship, Playground, Public Transit, Schools, Shopping",,"R4","https://cdn.realtor.ca/listing/TS637517487007070000/reb20/highres/4/40084054_1.jpg"
"40079369","An Awesome Semi on Court location in Laurelwood! THE LOCATION IS DESIRABLE AND THE LOT IS AMAZING! It is a  greenbelt lot with view of Pond, Greenbelt and Evening Sunsets. This custom designed 2 bedroom  bungalow Semi was designed for the present owners and offers many unique features.The open concept main floor features, soaring high vaulted ceilings in and kitchen/dinette area and great room with gas fireplace, a kitchen with breakfast island, appliances and lots of built-ins and counterspace that will certainly appeal to any Cook of the family and a great place to entertain guests. There is walkout from the dinette to a private deck and  the yard is fenced and overlooks the massive greenspace.The master bedroom is spacious  with Tray ceiling and offers a walk in closet and ensuite bath with  jetted tub and  a second bedroom that would be a great home office, plus a second 3pc. bath.There is a main floor laundry but a second laundry room was added in the lower level. The basement is partially finished and features lots of windows, loads of storage area, cold cellar and room to add extra bedrooms in the partially finished basement. Roof replaced in 2018 and there is a shed. Just steps away from much sought after High School and Elementary schools. Close to shopping mall, bus stop,YMCA Public library, UW and just a short walk to Laurel Creek Conservation area where you can hike, swim and canoe. Must be seen ! (63031112)","2","2 + 0","1200.0000","House",,"237 BUTTERCUP Court|Waterloo, Ontario N2V2W8","-80.59794812","43.47436133","N2V2W8",,"$649,900 ","Single Family","3","Freehold","Dishwasher, Dryer, Refrigerator, Stove, Water softener, Washer, Hood Fan, Window Coverings",,"Full (Partially finished)","Forced air, (Natural gas)","under 1/2 acre","Airport, Golf Nearby, Hospital, Park, Place of Worship, Playground, Public Transit, Schools, Shopping",,"Resendial","https://cdn.realtor.ca/listing/TS637517415582870000/reb16/highres/9/40079369_1.jpg"
"X5157747","Desirable Lincoln Heights. Newer Roof, Furnace, Ac In The Last 3 Years. 4 Bed 3 Bath Carpet Free Raised Bungalow Is Finished From Top To Bottom Quick Access To Highway, Schools, Shopping, 2 Universities Uptown Waterloo Parks, And Trails. Main Level Is Bright Features Hardwood Flooring. Dining Room Is Open Eat-In Kitchen With Tons Of Counter Space, Cabinetry, And Storage With A Full Wall Pantry. Down The Hall 3 Generous Sized Bedrooms.**** EXTRAS **** 5 Piece Family Bathroom That Has Been Beautifully Updated. Master Bedroom Retreat On A Level Of Its Own With No Shortage Of Storage And A Little Convenient 2 Piece Bath. Lower Level Has 2 Walkouts,3 Piece Bathroom That Has Been Remodeled, (28107123)","3","4",,"House",,"223 WINFIELD AVE|Waterloo, Ontario N2J3M8","-80.5115047","43.4793797","N2J3M8",,"$678,000 ","Single Family","3","Freehold",,,"Full (Finished)","Forced air (Natural gas)","59 FT",,"$3,828.52",,"https://cdn.realtor.ca/listing/TS637516859402000000/reb86/highres/7/x5157747_1.jpg"
"40081505","Attention first time home buyers and Investors. great sought-after neighbourhood in the Moorings of Eastbridge. Offering approximately 2,000 square feet of living space on all three levels. The layout is excellent for family enjoyment and entertaining. starting with a living room that leads into the kitchen and the dining area looking into the backyard through the walk out sliding doors. Upstairs features a large comfortable master bedroom with a walk-in closet that affords you ample space.  Also upstairs are two more spacious bedrooms. The basement has an updated full 3-piece bathroom and open living area that is ready to define. Three bathrooms in this home is truly a bonus. A great single garage with lots of upper storage. This home is located in an awesome neighbourhood only a few minutes from Conestoga mall, Grey Silo golf course, several walking and hiking trails, schools as well easy access to major travel routes. (63028688)","3","3 + 0",,"House",,"468-A HARBOUR VIEW Crescent|Waterloo, Ontario N2K4A3","-80.50986656","43.50747858","N2K4A3",,"$575,000 ","Single Family","3","Freehold","Central Vacuum, Dryer, Refrigerator, Stove, Water softener, Washer",,"Full (Partially finished)","Forced air, (Natural gas)","under 1/2 acre","Golf Nearby, Public Transit, Schools",,"RES","https://cdn.realtor.ca/listing/TS637516732168830000/reb16/highres/5/40081505_1.jpg"
"40061924","Desirable Lincoln Heights Gem This one checks all the boxes with Newer Roof, Furnace, AC in the last 3 years. This 4 bed 3 bath carpet free raised bungalow is finished from top to bottom and perfect for a growing family! Quick access to highway, schools, shopping, 2 universities uptown waterloo parks, and trails.  The Covered front porch is perfect to greet your guests. The main level is bright and inviting and features hardwood flooring. The Living Room has charming views of the front garden and mature tree-lined streetscapes. Dining room is open to the spacious eat-in kitchen with tons of counter space, cabinetry, and storage with a wall  of pantry. Just a few steps down the hall you will find 3 generous sized bedrooms and the 5 piece family bathroom that has been beautifully updated with newer vanity, stone countertop, and undermount double sinks and is a great size. The Master bedroom retreat is on a level of its own with no shortage of storage and little convenient 2 piece bath. The lower level has 2  walkouts offering tons of natural light. Walkout to an amazing mature backyard with trees to offer soft shade in the summer. Head back inside to the lower level and get cozy with your own gas fireplace and beautiful stone surround features. The basement bathroom has been remodeled in modern finishes. This level is finished with laundry and loads of storage. 223 Winfield Ave is move-in ready! (63009064)","3","4 + 0","1668.9000","House",,"223 WINFIELD Avenue|Waterloo, Ontario N2J3M8","-80.51154725","43.47929533","N2J3M8",,"$678,000 ","Single Family","2","Freehold","Dishwasher, Dryer, Refrigerator, Stove, Washer",,"Full (Finished)","Forced air","under 1/2 acre","Place of Worship, Playground, Public Transit, Schools, Shopping",,"RES","https://cdn.realtor.ca/listing/TS637516725426270000/reb16/highres/4/40061924_1.jpg"
"40083522","Dont miss your chance to own this spotless, well maintained family home in quiet neighbourhood. The bright main floor showcases the open concept layout with Hardwood and tile flooring. Spacious kitchen with raised breakfast bar, looking onto dining room & family room with sliding doors to 2- tiered deck & fully fenced yard. Convenient laundry/mudroom & 2-piece bathroom complete the main floor. Upstairs you will find a bonus family room  great for entertaining or work from home office. Master bedroom with ensuite bath and two generous sized walk-in closets. Two additional good size bedrooms and 4- piece family bathroom. Lower level is ready to create your own personalized layout for rec room, bedroom and has rough in for bathroom. Concrete driveway and patio gives this beauty great curb appeal. Major updates complete- ROOF, FURNACE, AIR CONDITIONING. Incredible location- Mere minutes from schools, parks and trails, transit, shopping at the Boardwalk & Costco, restaurants, gym, & nightlife. (63030260)","3","3 + 0",,"House",,"352 SAUVE Crescent|Waterloo, Ontario N2T2Y8","-80.57637081","43.45009706","N2T2Y8",,"$749,900 ","Single Family","2","Freehold","Central Vacuum, Dishwasher, Dryer, Refrigerator, Stove, Water softener, Washer, Window Coverings",,"Full (Unfinished)","Forced air, (Natural gas)","0|under 1/2 acre","Beach, Golf Nearby, Hospital, Park, Place of Worship, Playground, Public Transit, Schools, Shopping, Ski area",,"RES","https://cdn.realtor.ca/listing/TS637516696280870000/reb16/highres/2/40083522_1.jpg"
"40081110","In this new world of so many restrictions, seeing friends and family will be made EASY in this fully finished home with TWO outdoor entertaining areas! This open concept home features 9ft ceilings, a walkout basement, no rear neighbours & updates galore including all new 100% waterproof Luxury Vinyl Plank (LVP) flooring and trim through out main level. The eat-in kitchen features quartz countertops, new hardware and offers maple shaker cabinetry, a large centre island with eat up breakfast bar, built in microwave (2021) and dishwasher (2018), stove/oven (2020) and double door stainless steel fridge (2018). The living room boasts a gas fireplace w/herringbone tile design and custom built-ins on either side plus it's wired for surround sound! Walkout to the upper deck with glass panel railings & take in the views of the large beautifully landscaped, fully fenced yard. Included is your outdoor kitchen featuring Napoleon PRO BBQ with granite counter tops and faux stone face, perfect for entertaining! The shed/workshop has a poured foundation w/electricity run to it.  Upper level offers two secondary bedrooms, an updated 4pc main bathroom, laundry room & the impressive primary bedroom which boasts cathedral ceilings, walk-in closet & a fully renovated 3pc ensuite which features an oversized walk-in glass shower with subway style tiling and double shower heads, new vanity with quartz countertop, lighting and LVP flooring! The bright fin. walkout basement offers a full 4pc bath, bar/serving area w/beverage fridge, rec room with walkout to outdoor patio bar, w/keg fridge and hot tub!  This home is located in a highly desirable neighbourhood close to excellent schools, parks, trails, Grey Silo Golf Course, Conestoga Mall, the LRT & expressway! (63026655)","4","3 + 0",,"House",,"737 GRAND BANKS Drive|Waterloo, Ontario N2K4N2","-80.49841063","43.512875","N2K4N2",,"$737,000 ","Single Family","3","Freehold","Dishwasher, Dryer, Refrigerator, Stove, Washer, Microwave Built-in, Hot Tub",,"Full (Finished)","Forced air, (Natural gas)","under 1/2 acre","Park, Playground, Public Transit, Schools, Shopping",,"Residential","https://cdn.realtor.ca/listing/TS637516569604830000/reb16/highres/0/40081110_1.jpg"
"40081153","UPTOWN!! UPTOWN!! UPTOWN!! Attention anyone that desires to be in the heart of the city, WELCOME to 57 Peppler St. This recently renovated & upgraded home is in the heart of uptown Waterloo, 5 min walk to city center & all it's amenities. This charming, tastefully renovated 3 bedroom & 2 full bath home is perfect for anyone that likes to enjoy city life & wants to be close to the best of what uptown Waterloo has to offer. This is a great property for those who love to entertain, those who love to be comfy at home & those who want more than just an average home! With minimal maintenance & trendy finishes, this house is ready to be your home! Don't miss the fantastic backyard, a perfect spot to work from home, unwind after a long day or a great spot to start your night out on the town. (63026560)","2","3 + 0","975.0000","House",,"57 PEPPLER Street|Waterloo, Ontario N2J3C7","-80.52002658","43.4685526","N2J3C7",,"$699,000 ","Single Family",,"Freehold","Dishwasher, Dryer, Refrigerator, Stove, Water softener, Washer",,"Full (Finished)","(Natural gas)","under 1/2 acre","Park, Public Transit, Shopping",,"Residential","https://cdn.realtor.ca/listing/TS637516550912100000/reb20/highres/3/40081153_1.jpg"
"40082922","Welcome to 232 Auburn Drive. Enjoy this peaceful backyard with no rear neighbours! This immaculate three bedroom three bathroom detached home features hardwood floors throughout. Granite countertops in kitchen. Three generous size bedrooms. Family friendly neighbourhood. Fully fenced backyard backing onto park. Gas line for BBQ. This home has been very well cared for. Roof 2018. Basement ready for your finishing touches with 3-piece bathroom recently complete. Close to expressway, Grand River, trails, shopping, restaurants, dog park and more. This one wont last long! (63028305)","3","3 + 0",,"House",,"232 AUBURN Drive|Waterloo, Ontario N2K3T3","-80.48949937","43.48872608","N2K3T3",,"$699,900 ","Single Family","2","Freehold","Dishwasher, Refrigerator, Stove, Wine Fridge",,"Full (Partially finished)","Forced air, (Natural gas)","under 1/2 acre","Playground, Shopping",,"Residential","https://cdn.realtor.ca/listing/TS637517592650830000/reb16/highres/2/40082922_1.jpg"
"X5156623","Move In Ready, Fully Finished 3 Bed/ 4 Bath Home In Waterloo's Clair Hills. Hardwood And Ceramic,. Updated Kitchen, Granite Tops, & Stainless Appliances. Formal Living & Dining With Sliders To Composite Sundeck & Power Awning. Large Privacy Fenced Rear Yard. Upper Level Features Generous Master Suite With Double Closets & Full 4Pc Ens. Upper Floor Includes Laundry Room,1776 Sq. Ft Beautiful Interior Space, Playground Around The Corner, Access To Everything.**** EXTRAS **** Refrigerator, Stove, Dishwasher, Washer & Dryer + Garage Door Opener Included (28101380)","10","3",,"House",,"#B -711 KARLSFELD RD|Waterloo, Ontario N2T2W4","-80.5786679","43.457337","N2T2W4",,"$688,000 ","Single Family","2","Freehold",,,"N/A (Finished)","Forced air (Natural gas)","25.14 x 114.46 FT ; Lane At Rear",,"$3,008.89",,"https://cdn.realtor.ca/listing/TS637516870395870000/reb86/highres/3/x5156623_1.jpg"
