MlsNumber,PublicRemarks,Bathrooms,Bedrooms,InteriorSize,Type,Ammenities,Address,Longitude,Latitude,PostalCode,NeighbourHood,Price,PropertyType,ParkingSpace,OwnershipType,Appliances,FlooringType,BasementType,HeatingType,LandSize,AmmenitiesNearBy,PropertyTax,ZoningDescription,LowResPhoto
"40077124","Take the time to stop and appreciate this stunning two year old, freehold, end unit Mattamy townhome in the sought after Doon South neighbourhood. The 3 bedroom, 2.5 bathroom home is practically brand new with the builder direct upgrades galore. On the main floor you will find a contemporary, oversized, eat-in white kitchen with granite countertops, gorgeous pendant lightning, tasteful backsplash, stainless steel appliances including a gas range and large breakfast bar/island. This end unit is complete with extra windows to make this carpet free living room and dining room combination feel bright and spacious. The main level also includes a powder room. This home is the definition of open concept living. Dark stained hardwood stairs lead you to the second floor where you will find a large master suite at the back of the house, walk-in closet and en-suite; complete with a double vanity and walk-in shower. The upper level also boasts two further bedrooms, a full bath and laundry. Yes! A full laundry room on the second level! The large basement in this home is unfinished and awaiting the next owners creative touch to turn it into the perfect family space or additional bedroom. There is access to the garage from the home with one driveway space. Doon South is one of the best neighbourhoods in Kitchener. This home faces north and will get southern exposure all afternoon and evening long to enjoy the warm Ontario summer. It has unbeatable access to the 401, great schools, trails, golf and shopping. This home is ideal for first time home buyers or investors alike. Reach out to your agent today to book your showing of this immaculate townhome because if you blink, it'll be gone! (63022476)","3","3 + 0","1783.0000","House",,"54 WATERMILL Street|Kitchener, Ontario N2P0H3","-80.43217522","43.374059","N2P0H3",,"$675,000 ","Single Family",,"Freehold","Dishwasher, Dryer, Refrigerator, Washer, Range - Gas, Hood Fan, Window Coverings",,"Full (Unfinished)","Forced air, (Natural gas)","under 1/2 acre","Golf Nearby, Park, Place of Worship, Playground, Schools, Shopping",,"RES","https://cdn.realtor.ca/listing/TS637516532601470000/reb44/highres/4/40077124_1.jpg"
"40082602","Imagine a central location, attractive curb appeal, bountiful updates and charming original craftsmanship all in one tidy package! Just around the corner from Woodside Park, 10 minutes from Victoria Park, and only 20 minutes by foot from the corner of King and Queen  the very heart of DTK  sits 52 Woodland Avenue. This immensely appealing and classically handsome three-bedroom and two-bathroom family home is packed full of recent updates; possessing all the modern conveniences but retaining the warmth of old world craftsmanship where it counts. A bevy of bigticket items have been overhauled over the past decade, including an all-new roof in 2020, new contemporary lighting, a new owned water heater (2020), updated electrical including a 200 amp panel PLUS an additional 50 amp service to the garage, water softener (2012), attic insulation (2012), deck with gas BBQ hookup (2010), shed (2015), furnace (2009), plus newer windows, doors and more! Nestled on a maturely wooded 115-foot deep lot, these contemporary updates blend seamlessly with beautiful original hardwood floors, warm wooden baseboards and gumwood trim. Other wonderful touches include a walkout to the elevated balcony from your jacuzzi tub and a finished basement rec room with a gas fireplace. Walk to work in Kitcheners core, or be on the expressway in a matter of five minutes at Homer Watson Boulevard. Call or click for more information today! (63027986)","2","3 + 0",,"House",,"52 WOODLAND Avenue|Kitchener, Ontario N2M3G7","-80.49050718","43.43799016","N2M3G7",,"$625,000 ","Single Family",,"Freehold","Dishwasher, Dryer, Stove, Water softener, Washer, Microwave Built-in, Window Coverings",,"Full (Finished)","Forced air, (Natural gas)","0|under 1/2 acre","Golf Nearby, Hospital, Park, Place of Worship, Public Transit, Schools, Ski area",,"Residential","https://cdn.realtor.ca/listing/TS637516872655030000/reb16/highres/2/40082602_1.jpg"
"X5156483","The Home You Have Been Waiting For! Located On A Quiet, Family-Friendly Crescent And In The Desirable Neighborhood Of Country Hills. This Home Is One You Will Surely Fall In Love With! Featuring A Premium Lot With An Oversized Deck And Beautiful Landscaping. On The Main Floor You Have A Beautiful Living Room With A Fireplace, An Open Concept Kitchen, And An Abundance Of Natural Light. The Second Floor Features Generous-Sized Bedrooms And A Huge Master Bedroom**** EXTRAS **** Updates Include A New Roof, Furnace, And Garage Door. (28101804)","3","3",,"House",,"362 HIGHBROOK CRES|Kitchener, Ontario N2E3P5","-80.5020566","43.409575","N2E3P5",,"$649,900 ","Single Family","3","Freehold",,,"N/A (Partially finished)","Forced air (Natural gas)","30.71 x 105.71 FT",,"$3,430",,"https://cdn.realtor.ca/listing/TS637516526855730000/reb82/highres/3/x5156483_1.jpg"
"40083165","Welcome to 35 Weichel, a beautifully updated home with a backyard oasis that dreams are made of. The gorgeous main floor features an open concept, spacious living room and impressive eat-in kitchen with quartz countertops and stainless steel appliances. The upper level offers 3 large bedrooms and a stunning full washroom, ideal for small families, young professionals and those needing extra work-from-home space. The lower level houses a cozy family room warmed by a gas fireplace and bright windows which features a charming built-in bar perfect for hosting. Topped off with a bonus room offering incredible storage, a fully finished work room with bench and an additional full washroom, perfect for the direct pool walkup. The dream back yard offers a gorgeous swimming pool, complete with new water heater, open wood deck, and a convenient pool hut! Enjoy dining under the stars with the fully lit pergola which seats up to ten guests. Impeccable timing to take advantage of the summer season. Within walking distance to Belmont Village and the Iron Horse Trail. (63027893)","2","3 + 0","1050.0000","House",,"35 WEICHEL Street|Kitchener, Ontario N2M2A7","-80.51851252","43.44186358","N2M2A7",,"$599,900 ","Single Family","4","Freehold","Central Vacuum, Dishwasher, Dryer, Microwave, Refrigerator, Stove, Water softener",,"Full (Finished)","Forced air, (Natural gas)","under 1/2 acre","Hospital, Place of Worship, Public Transit, Schools",,"R-3","https://cdn.realtor.ca/listing/TS637516497002130000/reb16/highres/5/40083165_1.jpg"
"40078207","Take in all that Grand River South has to offer at 1348 Old Zeller Drive, Kitchener. This highly sought after neighbourhood is mere minutes from the Grand River, trails, Chicopee Ski Resort, excellent schools, arenas, and the Region of Waterloo Airport. Incredibly well-kept and stylishly decorated throughout, this home is more than move in ready - the well laid out main floor is bright and spacious. Your inviting family room is flooded with natural light and offers sightlines to an attractive eat-in kitchen. Entertaining is a delight here with the open concept space including espresso wood cabinetry, island/breakfast bar, upgraded lighting, stainless steel appliances, and stylish backsplash. You will also find a 2 piece bathroom on the main floor of this home. The second floor boasts 3 generous sized bedrooms and a family bath. Your master suite includes double closets, 3 oversized windows, and your very own 3 piece ensuite. The lower level is awaiting your personal vision! Prepare to be impressed as you step outdoors to an expansive beautifully constructed deck perfect for barbecuing, complete with a gas line hooked up for your bbq. The fenced rear yard has plenty of space to play, garden, and enjoy those long summer days. An added bonus here - neighbours only on one side offering added privacy! Make Grand River South your community - book your showing today. (63022725)","3","3 + 0","1552.0000","House",,"1348 OLD ZELLER Drive|Kitchener, Ontario N2A0C6","-80.40791737","43.45333639","N2A0C6",,"$700,000 ","Single Family","2","Freehold","Dishwasher, Dryer, Refrigerator, Stove, Washer",,"Full (Unfinished)","Forced air, (Natural gas)","under 1/2 acre","Park, Public Transit, Schools",,"RES","https://cdn.realtor.ca/listing/TS637516191586970000/reb16/highres/7/40078207_1.jpg"
"40083102","Amazing Single Detached in the desirable Lackner Woods Area surrounded by Trails and River, close to all amenities, easy access to Guelph, Cambridge and to 401, 7 Minutes to Costco, schools and shopping. This Beauty is welcome you with 9 ft Ceilings on Main Floor and many upgrades throughout such a beautiful ceramic and hardwood flooring, Kitchen Backsplash, SS Appliances, Gas Stove, surround sounds speakers  throughout and outside, CAT 5 in every room, Gas line for your BBQ, Beautiful Deck, Finished Walk out Basement with One Bedroom and a bathroom. The Second Floor has very good side bedrooms and Master bedroom with En-suite Bathroom. Book your showing Today! (63027377)","4","3 + 1","1860.0000","House",,"1472 OLD ZELLER Drive|Kitchener, Ontario N2A0H3","-80.40608189","43.45076372","N2A0H3",,"$749,900 ","Single Family","3","Freehold","Central Vacuum, Dishwasher, Dryer, Refrigerator, Water softener, Washer, Gas stove(s), Hood Fan, Window Coverings",,"Full (Finished)","Forced air, (Natural gas)","under 1/2 acre","Airport, Park, Public Transit, Schools",,"RES","https://cdn.realtor.ca/listing/TS637516118998770000/reb16/highres/2/40083102_1.jpg"
"H4100809","Beautiful Detached Bungalow located in Sought after Family Friendly Neighbourhood of Forest Hill! Features 3 Bedroom, 2 baths, Home has been Tastefully Renovated throughout, High End Laminate Flooring/Kitchen 2021, Furnace 2019, Front/ Side Door replaced 2021. Basement features Large Living room, Kitchenette, 3 PC Bath, Office and Den. Walking distance to schools and local amenities. 2 Mins to Expressway and Sunrise Shopping Plaza. (27043864)","2","3","994.0000","House",,"292 Overlea Drive|Kitchener, Ontario N2M1T8","-80.522846","43.430502","N2M1T8",,"$649,900 ","Single Family","3","Freehold",,,"Full (Finished)","Forced air (Natural gas)","40 x 120|under 1/2 acre",,"$2,946.66","R2C","https://cdn.realtor.ca/listing/TS637516012670000000/reb14/highres/9/h4100809_1.jpg"
"X5155849","Beautiful Detached Bungalow Located In Sought After Family Friendly Neighbourhood Of Forest Hill! Features 3 Bedroom, 2 Baths, Home Has Been Tastefully Renovated Throughout, High End Laminate Flooring/Kitchen 2021, Furnace 2019, Front/ Side Door Replaced 2021. Basement Features Large Living Room, Kitchenette, 3 Pc Bath, Office And Den. Walking Distance To Schools And Local Amenities. 2 Mins To Expressway And Sunrise Shopping Plaza.**** EXTRAS **** Hwhtr Is Rental (28099467)","2","3",,"House",,"292 OVERLEA DR|Kitchener, Ontario N2M1T8","-80.5228558","43.4305347","N2M1T8",,"$649,900 ","Single Family",,"Freehold",,,"N/A","Forced air (Natural gas)","40 x 120 FT",,"$2,946.66",,"https://cdn.realtor.ca/listing/TS637516025498930000/reb82/highres/9/x5155849_1.jpg"
"40074759","CHECK OUT this OUTSTANDING Cape Cod style two storey in desirable Forest Heights. This stunner has two separate living spaces on the main floor as well as an open concept kitchen that has been completely updated within the last 5 years. It boasts an island for your prepping needs, under cabinet lighting, soft close maple cabinetry and overlooks the beautiful WETT certified wood fireplace in the living room. You're able to watch the kids in the private backyard with gate access on either side from the slider door or join them on the back patio and read a book while you listen to the beautiful sounds of nature! There is also a hot tub hook up, set one up and enjoy quiet night caps under the stars! Do you need a HOME OFFICE? You could easily turn the existing dining room into a doored office!  Just off the single car garage you'll find a mudroom, access to the basement and a powder room! You could convert this home into an IN-LAW SUITE utilizing the existing kitchenette/counter space downstairs. R3 zoned with DUPLEX POTENTIAL for the right buyer!  As you make your way upstairs you are met with 4 large sized bedrooms! The Master Bedroom has tons of space and you could add an en-suite should your heart desire! The main bathroom has had a tub and toilet replacement in the last 5 years and offers tons of beautiful natural light! Downstairs you'll find an updated rec room and bedroom or use that room as another at home office! It has been completely redone with fresh paint, flooring and trim in the last few weeks just in time for the new owner to enjoy! You'll also find a laundry/kitchenette with boat loads of potential and lots of storage! This home is within walking distance to John Darling P.S. and ALL THE AMENITIES that Ira Needles and Highland Hills mall have to offer. You are minutes to the 7/8 and 401 for any commuting needs all the while living in one of the most sought-after neighbourhoods in KW. Inquire about our full list of updates or call your realtor today! (63017768)","2","4 + 1","1889.0000","House",,"22 COVINGTON Crescent|Kitchener, Ontario N2N2W6","-80.54861763","43.42137386","N2N2W6",,"$675,000 ","Single Family","3","Freehold","Dishwasher, Refrigerator, Stove, Water softener",,"Full (Finished)","Forced air","0.123 ac|under 1/2 acre","Hospital, Park, Place of Worship, Playground, Public Transit, Schools, Shopping",,"R3","https://cdn.realtor.ca/listing/TS637516005191800000/reb16/highres/9/40074759_1.jpg"
"40081280","An excellent family home, located on a quiet street just steps to the Sunrise Centre and easy access to highways 7/8.  The main floor is inviting, with an open concept layout and sliding doors to a generous back yard with metal gazebo, just perfect for summer entertaining. This carpet free 3 bed 2 bath home has been very well maintained and has new laminate flooring in the living room and has been freshly painted.  The unfinished basement has been framed and just waiting for your finishing touches.  This semi-detached has a newer composite front porch and back deck surrounded with a beautiful stamped concrete walkway and patio. The generous driveway has parking for 3 vehicles. (63022175)","2","3 + 0",,"House",,"16 WATERCRESS Court|Kitchener, Ontario N2E3S8","-80.5164944","43.41203638","N2E3S8",,"$599,000 ","Single Family","4","Freehold","Dishwasher, Microwave, Refrigerator, Stove, Water softener, Hood Fan",,"Full (Unfinished)","Forced air, Hot water radiator heat, (Natural gas)","under 1/2 acre","Hospital, Park, Place of Worship, Public Transit, Schools, Shopping",,"RES","https://cdn.realtor.ca/listing/TS637516734778400000/reb16/highres/0/40081280_1.jpg"
"40082349","Welcome to 81 Hillbrook Crescent this great family home backs and sides onto greenspace and offers 4 bedrooms, upper level laundry, main floor family room addition with gas fireplace with walk out to back yard and enclosed front porch. Lots of parking with extra long driveway and no sidewalks to shovel. Basement offers lots of storage and a finished recroom, craft room area or huge 5th bedroom with gas fireplace. Newer fridge, washer and dryer. (63023283)","2","4 + 0","1910.0000","House",,"81 HILLBROOK Crescent|Kitchener, Ontario N2N1J4","-80.52863","43.42369533","N2N1J4",,"$599,900 ","Single Family","5","Freehold","Dishwasher, Dryer, Refrigerator, Stove, Washer, Window Coverings",,"Full (Partially finished)","Forced air, (Natural gas)","under 1/2 acre","Park, Place of Worship, Playground, Public Transit, Schools, Shopping",,"Residential","https://cdn.realtor.ca/listing/TS637515885441300000/reb16/highres/9/40082349_1.jpg"
"X5155212","You Can Buy It Today! Renovated Sidesplit On Quiet Cul-De-Sac In Forest Hill Stunning Main Floor With An Abundance Of Light Coming Through New Bay Window, Spacious Living Room W/ Hardwood Floors. The Bright, White Kitchen Is Highlighted W/ Ss Appliances, Soft Close Cabinetry & Opens To The Dining Area. Upstairs You'll Find Newly Renovated 4Pc Bath, 3 Good-Sized Bedrooms. Make Your Way To The Finished Rec Room W/ Separate Entrance, Large Windows And 3Pc Bath. (28095817)","2","3",,"House",,"54 BARBERRY PL|Kitchener, Ontario N2M4H9","-80.5069637","43.4308139","N2M4H9",,"$750,000 ","Single Family","4","Freehold",,,"N/A (Finished)","Forced air (Natural gas)","62.01 x 100 FT",,"$3,221",,"https://cdn.realtor.ca/listing/TS637515852134900000/reb86/highres/2/x5155212_1.jpg"
"X5154661","Pride Of Ownership Is Evident In This Bright & Modern 2 Storey Detached Home. Featuring An Open Concept Main Floor Layout & Laminate Flooring Throughout! The Updated Kitchen Features Stainless Steel Appliances, Gas Stove & Ton Of Countertop & Cupboard Space. Combined Living Room & Dining With A Ton Of Natural Light & W/O To Backyard.3 Spacious Bedrooms On Upper-Level W/ Upgraded 4Pc Bathroom. Enjoy The Finished Basement With Stone Feature Wall!**** EXTRAS **** Massive Backyard Equipped W/ Deck, Gazebo& Shed! Minutes From Grand River & All Amenities That Come W/ It. Incl: Alarm System, Fridge,Stove, Dishwasher,Washer/Dryer, Window Coverings, All Tv Mounts, Basement Projector&Screen (28095244)","2","3",,"House",,"459 OTTERBEIN RD|Kitchener, Ontario N2B3V8","-80.4249695","43.463566","N2B3V8",,"$589,900 ","Single Family","3","Freehold",,,"N/A (Finished)","Forced air (Natural gas)","29.99 FT","Park, Schools","$3,222",,"https://cdn.realtor.ca/listing/TS637515852042830000/reb86/highres/1/x5154661_1.jpg"
"X5155386","For More Greater  Details On This Property In Realtor.Ca Search For Mls# 40081589 Nice 3+1 Bedroom All Brick Raised Bungalow That Has Been Nicely Updated In The Stanley Park Area Of Kitchener. 2 Baths, One Is A Renovated 5 Pc With Heated Floors The Other Is A 4 Pc. Large 2 Car Garage With 2 Accesses To The Basement. Kitchen With Island And Stools. Tastefully Decorated Throughout.**** EXTRAS **** Fridge, Stove, Dishwasher, Washer, Dryer, Kitchen Island And Stools, (28095996)","2","3 + 1",,"House",,"14 GEORGIAN CRES|Kitchener, Ontario N2B3N9","-80.440603","43.466786","N2B3N9",,"$700,000 ","Single Family","4","Freehold",,,"N/A (Finished)","Forced air (Natural gas)","52 x 100 FT","Park, Public Transit, Schools","$3,827",,"https://cdn.realtor.ca/listing/TS637515852168470000/reb86/highres/6/x5155386_1.jpg"
"40081845","Welcome to 209 Samuel Street in the prestigious East Ward! Meticulously updated from top to bottom, taken right down to the studs and entirely renovated. The feature list is endless in this gorgeous home! Brand new doors at the main entrance, new roof, windows, plumbing and electrical (125 amp), new HVAC system, AC and furnace, spray foam insulation on upper levels, fresh paint and high-efficiency washer and dryer! Beautiful open-concept layout with clear sightlines between rooms and lovely exposed brick. New hardwood flooring on main and upper levels! The CUSTOM kitchen features high-efficiency stainless steel appliances, induction oven, Quartz countertops, a built-in cutting board and added storage with kickplates!  The list of upgrades continues on the exterior of the home! The front porch has been entirely rebuilt, new shed (9x11 workshop) with electrical and on a concert pad, in 2019 new concrete on the driveway, a BBQ gas line has been added, and you will especially enjoy this low maintenance yard! Do not miss out on this home, it won't last long! (63021706)","2","3 + 0","1144.0000","House",,"209 SAMUEL Street|Kitchener, Ontario N2H1R4","-80.47536702","43.44803574","N2H1R4",,"$599,900 ","Single Family",,"Freehold","Dryer, Microwave, Refrigerator, Stove, Water softener, Washer, Window Coverings",,"Full (Finished)","Forced air, (Natural gas)","0.06 ac|under 1/2 acre","Hospital, Park, Place of Worship, Playground, Public Transit, Schools",,"res","https://cdn.realtor.ca/listing/TS637515795377300000/reb16/highres/5/40081845_1.jpg"
"40082119","This bright, carpet free home has been meticulously maintained and upgraded in all the right places. Upgrades include new kitchen cabinets and appliances (2016), quartz counter tops (2017), new furnace and A/C (2017), windows (2015) and both bathrooms have been completely renovated (2016). Sitting in behind the spacious garage is a bonus room that was finished and insulated in 2019, which could be used as a home office or a space for crafts and other creative endeavours. Also at the back of the house is a patio area surrounded by new fencing that was put up in 2016. The front and side yards get plenty of sun, which makes for endless landscaping and gardening possibilities. It is also ideally located a short drive from the expressway, and within walking distance of several parks, schools and amenities.  63 Gibson Road is the perfect place to plant roots! (63021725)","2","3 + 0","1064.0000","House",,"63 GIBSON Drive|Kitchener, Ontario N2B2P5","-80.445093","43.4555744","N2B2P5",,"$724,900 ","Single Family","3","Freehold","Dishwasher, Dryer, Freezer, Microwave, Refrigerator, Stove, Water softener, Washer, Window Coverings",,"Full (Finished)","Forced air, (Natural gas)","under 1/2 acre","Park, Place of Worship, Playground, Public Transit, Schools, Shopping",,"Residential","https://cdn.realtor.ca/listing/TS637520173376570000/reb16/highres/9/40082119_1.jpg"
"40082539","Stunning 4 bedroom, 4 bathroom home in the desirable Wildflowers Community of Kitchener. Easy to mistake for a model home, this move-in ready home with neutral décor offers ample room for a growing family and for those working at home. The main level is bright and boasts a gorgeous kitchen with granite countertops, an inviting family room with gas fireplace, a dinette/breakfast nook off the kitchen with a walkout to the yard, separate dining room, a pantry and gleaming hardwood floors. From the foyer, the beautiful staircase leads to the 4 bedrooms on the upper level. In the master bedroom, you will find a walk-in closet and a 4-pc ensuite bathroom. There is also a spacious main bathroom and laundry room on the upper floor. On the lower level, there is a professionally finished basement with a recroom, office/den, a 3-pc bathroom and plenty of storage. The nicely appointed home has been freshly painted and boasts many other upgrades. The location is ideal and is close to shopping, schools, parks, nature trails, and the highway. This home has so much to offer. Book your viewing today! (63022277)","4","4 + 0","1780.0000","House",,"357 APPLE HILL Crescent|Kitchener, Ontario N2R0E8","-80.49312846","43.38727527","N2R0E8",,"$729,900 ","Single Family",,"Freehold","Dishwasher, Dryer, Refrigerator, Stove, Water softener, Washer, Microwave Built-in",,"Full (Finished)","Forced air, (Natural gas)","under 1/2 acre","Golf Nearby, Hospital, Park, Place of Worship, Playground, Public Transit, Schools",,"Residential","https://cdn.realtor.ca/listing/TS637515777317400000/reb16/highres/9/40082539_1.jpg"
"40080188","Welcome home to 330 Shelly Ave. This bungalow is situated in a great neighborhood close to schools, parks, shopping, LRT, Parking for more than 4 cars. Perfect for investors, downsizes, and first time buyers who want a mortgage helper.Over looking to creek and quite street. The main floor has lovely hardwood flooring, good sized living room, sliders that lead to the large deck and big yard. Spacious Kitchen with Granite counter top. Separate dinning area, Upper unit has own laundry. The lower level has a separate entrance,great open concept design with a nice size kitchen and living room. There is a 3 pc bath, separate laundry, plenty of storage and 2 really good sized bedrooms with large windows.Basement has laminated flooring also fireplace in Dinning room.ATTENTION INVESTORS!!  full brick bungalow located in the highly coveted Fairview Area on a 65 feet lot.  Move-in to the upper unit and collect the rent from lower unit or buy as investment and set your own rents. Projected rent $3700+Utilities. AAA Location , 15 mins to Hwy 401 and only minutes to Hwy 7/8. A must see property!! Property will be vacant at closing. Park like setting. Won't Last long. (63019707)","2","3 + 2","1171.0000","House",,"330 SHELLEY Drive|Kitchener, Ontario N2C1N1","-80.46002956","43.42766357","N2C1N1",,"$699,900 ","Single Family","6","Freehold","Water meter, Water softener",,"Full (Finished)","Forced air, (Natural gas)","under 1/2 acre","Hospital, Park, Place of Worship, Schools, Shopping",,"Residential","https://cdn.realtor.ca/listing/TS637515753839900000/reb16/highres/8/40080188_1.jpg"
