MlsNumber,PublicRemarks,Bathrooms,Bedrooms,InteriorSize,Type,Ammenities,Address,Longitude,Latitude,PostalCode,NeighbourHood,Price,PropertyType,ParkingSpace,OwnershipType,Appliances,FlooringType,BasementType,HeatingType,LandSize,AmmenitiesNearBy,PropertyTax,ZoningDescription,LowResPhoto
"40076796","This Spacious Move In Ready Home Is A Must See! 4 Bed, 3 Bath, And A Finished Basement! Steps Away From High Ranking Public And Catholic Schools, Public Parks, Shopping Mall And Amenities. This Gem Is Perfect For Families Who Need More Space. The Main Floor Is Spacious, With A Large Eat-In Kitchen. There Is Direct Access To The Deck And The Fully Fenced Yard. Downstairs, The Basement Is Finished, With A Rec Room And A Bathroom. Easy Access To Highways.**** EXTRAS **** Dishwasher, Fridge, Stove, Washing Machine, Dryer, Microwave Are Included Hot Water Tank Rental (62977791)","3","4 + 0",,"House",,"35 COTTON GRASS Street|Kitchener, Ontario N2E3T7","-80.510912","43.406749","N2E3T7",,"$749,000 ","Single Family","2","Freehold","Central Vacuum - Roughed In, Dishwasher, Dryer, Microwave, Refrigerator, Stove",,"Full (Finished)","Forced air, (Natural gas)","under 1/2 acre","Park, Public Transit, Schools",,"Residential","https://cdn.realtor.ca/listing/TS637508336582230000/reb16/highres/6/40076796_1.jpg"
"40077789","Opportunity abounds! Renovated duplex in Downtown/East Ward beckons for your immediate attention! Nearly $34,000 Gross Annual Income available here!  Hi-lites: Updated kitchens with contemporary white cabinets. Modernized bathrooms. Carpet free. Newer vinyl windows, newer roof, newer furnace (2017). Upper unit has insulated, unfinished loft and its own electrical panel. Main unit has vinyl plank flooring throughout and two bathrooms. Note: detached single car garage with easy parking access off of Betzner. Two households with vehicles can park independently - side-by-side.  Great tenants, both on month-to-month, with written leases. Main unit pays $1533 per month inclusive. Upper unit pays $1277 per month inclusive.  Main floor tenant has provided notice for May 1, 2021. Easy walk to Downtown and all its amenities including Farmers' Market, The Museum, Library, Courthouse and Night Life. One block from Kitchener Market LRT Stop. 12 minute walk to Kitchener Auditorium. Good, flexible zoning which allows for many supplemental uses. This home is ideal for investor looking to get a deed in their name or owner occupier that craves mortgage helper income - in perennially one of the best real estate markets in Ontario! (62978505)","3","3 + 1",,"House",,"177 WEBER Street E|Kitchener, Ontario N2H1E3","-80.47794956","43.44747647","N2H1E3",,"$649,900 ","Single Family","3","Freehold",,,"Full (Partially finished)","Forced air","under 1/2 acre","Park, Public Transit, Shopping",,"CR-1","https://cdn.realtor.ca/listing/TS637518288507030000/reb16/highres/9/40077789_1.jpg"
"40077822","A YARD WITH ENDLESS POSSIBILITIES! This spacious semi is tucked away in a family-friendly neighbourhood close to parks, great schools, shopping, and walking trails. With a bright open concept main floor layout including an eat-in kitchen and family room with sliders taking you to the massive fenced yard. Stairs with Wrought Iron spindles lead to the upper 3 bedrooms with a primary suite offering a full walk-in shower. Finished basement for additional storage, living space or home office! Single garage and double wide beautiful interlock driveway. Sought after Huron Park with close proximity to the 401! MUST DOWNLOAD SENTRI CONNECT-NO ONE DAY CODES WILL BE GIVEN. (62977559)","3","3 + 0","1639.0000","House",,"175 PARKVALE Drive|Kitchener, Ontario N2R1Z1","-80.47719654","43.38875342","N2R1Z1",,"$700,000 ","Single Family","3","Freehold",,,"Full (Partially finished)","Forced air, (Natural gas)","under 1/2 acre","Park, Public Transit, Schools",,"RES","https://cdn.realtor.ca/listing/TS637508216834000000/reb20/highres/2/40077822_1.jpg"
"40077374","Opportunity knocks with this residential home in the heart of the City! Centrally located, this spacious family home offers a layout allowing for easy conversion to an in-law set up. Beautiful covered front porch leads into the classic front foyer of homes from this area. Main floor has a newer living room/washroom addition with sliders to a deck overlooking the huge backyard. Spacious eat-in kitchen and Master bedroom with walk in closet also on the main floor. Upstairs offers four bedrooms, one currently being used as a kitchenette but easily converted to its original state. Oversized, insulated garage and workshop is a must see! Full length work area with work bench, built-ins, hydro and plumbing. Huge yard with a shed on concrete pad and hydro. Parking for at least 6 cars on the concrete driveway. Two minute drive to the expressway or two minute drive downtown! (62976909)","2","4 + 0","1520.0000","House",,"477 WELLINGTON Street N|Kitchener, Ontario N2H5L4","-80.48188771","43.46157394","N2H5L4",,"$599,900 ","Single Family","8","Freehold","Dishwasher, Dryer, Refrigerator, Stove, Water softener, Washer",,"Full (Partially finished)","Forced air, (Natural gas)","under 1/2 acre","Airport, Golf Nearby, Hospital, Park, Place of Worship, Public Transit, Schools, Shopping, Ski area",,"RES","https://cdn.realtor.ca/listing/TS637508221007800000/reb16/highres/4/40077374_1.jpg"
"X5141165","This Spacious Move In Ready  Home Is A Must See! 4 Bed, 3 Bath, And A Finished Basement! Steps Away From High Ranking Public And Catholic Schools, Public Parks, Shopping Mall  And Amenities. This Gem Is Perfect For Families Who Need More Space. The Main Floor Is Spacious, With A Large Eat-In Kitchen. There Is Direct Access To The Deck And The Fully Fenced Yard. Downstairs, The Basement Is Finished, With A Rec Room And A Bathroom. Easy Access To Highways.**** EXTRAS **** Dishwasher, Fridge, Stove, Washing Machine, Dryer, Microwave Are Included Hot Water Tank Rental (28037641)","3","4",,"House",,"35 COTTON GRASS  ST|Kitchener, Ontario N2E3T7","-80.5109587","43.4066965","N2E3T7",,"$749,000 ","Single Family","3","Freehold",,,"N/A (Finished)","Forced air (Natural gas)","30 x 104 FT",,"$3,452.42",,"https://cdn.realtor.ca/listing/TS637507877630600000/reb82/highres/5/x5141165_1.jpg"
"X5140709","Beautiful Detached Backsplit Located In Desirable Forestheights! Features 3 Bdrms, 2 Baths, Home Has Been Tastefully Renovated Kitchen Has Granite Counters, High End Vinyl Flooring, Windows/Doors, Ss Appliances. Roof Shingles All Replaced 2019, Home Has A Separate Side Entrance Into Spacious Family Room Has A Wet Bar And Gas Fireplace, Relax In The Spa Bathroom In Basement. Walking Distance To Schools And Local Amenities, 2 Mins To Highway 7/8.**** EXTRAS **** Rental Equipment: Hot Water Heater (28036006)","2","3",,"House",,"69 BROKEN OAK CRES|Kitchener, Ontario N2N1N8","-80.5417398","43.4189679","N2N1N8",,"$599,900 ","Single Family",,"Freehold",,,"N/A (Partially finished)","Forced air (Natural gas)","40.02 x 100 FT",,"$2,880.68",,"https://cdn.realtor.ca/listing/TS637507008883630000/reb82/highres/9/x5140709_1.jpg"
"X5140035","Welcome To A Beautiful Home Sweet Home. Stunning Semi-Detach Located In A Fantastic Neighborhood, Spacious Layout. Big Sun Filled Windows Throughout, 3+1 Large Bedrooms & 4 Bathrooms, Brand New Professionally Finished Basement With Bedroom And A Family Room. Extra Deep Lot, Nicely Landscaped.Hot Tub**** EXTRAS **** Fridge, Stove, B/I Dishwasher, Washer & Dryer, All Elf's, All Window Coverings, Hot Tub. (28033797)","4","3 + 1",,"House",,"26 FOURTH AVE|Kitchener, Ontario N2C1N8","-80.4532297","43.4341144","N2C1N8",,"$699,988 ","Single Family","7","Freehold",,,"N/A (Finished)","Forced air (Natural gas)","39.4 x 132.52 FT","Park, Public Transit, Schools","$3,560",,"https://cdn.realtor.ca/listing/TS637506148622000000/reb82/highres/5/x5140035_1.jpg"
"X5139375","63Ft Wide Corner Lot In Desirable Forest Heights Community. Investors & First Time Buyers Look No Further - Fantastic Opportunity To Own A Detached 4 Level Backsplit With 2 Bedroom Basement Apartment Lookout Windows Nicely Finished With Separate Entrance And Laundry. No Carpet In The House. Nicely Renovated Kitchen And Laminate Flooring Throughout. 2017 New Roof, Windows, Electrical Panel, Central Ac, Bathrooms. Large Window In Living Room Fronting The House.**** EXTRAS **** 2 Fridge, 2 Stove, 1 Dish Washer, All Electrical Lights And Fixtures. - Pics Uploaded Are Of Vacant Property, Currently Tenant Occupied. Sellers Or La Do Not Warrant Retrofit Status Of The Basement Apt. (28031897)","2","3 + 2",,"House",,"137 MONTEAGLE CRES|Kitchener, Ontario N2N1N2","-80.5350549","43.426848","N2N1N2",,"$699,000 ","Single Family",,"Freehold",,,"N/A","Forced air (Natural gas)","63.7 x 95.15 FT ; 60.43 Ft X 95.15 Ft X 63.79 Ft X 45.61 F",,"$3,250",,"https://cdn.realtor.ca/listing/TS637505821426870000/reb82/highres/5/x5139375_1.jpg"
"40074096","Attention Investors!!! Fully rented Legal Duplex.  3 bedrooms up and 3 bedrooms down.  Insuite laundry.  Great location close to tons of amenities. (62965898)","2","3 + 3",,"House",,"169 FERGUS Avenue|Kitchener, Ontario N2A2H4","-80.43882","43.435513","N2A2H4",,"$649,900 ","Single Family","4","Freehold","Dryer, Refrigerator, Stove",,"Full (Finished)","Forced air, (Natural gas)","under 1/2 acre","Hospital, Park, Place of Worship, Public Transit, Schools",,"R2B","https://cdn.realtor.ca/listing/TS637506150443370000/reb20/highres/6/40074096_1.jpg"
"X5135679","30 Yager Ave Located In A Quiet Family-Friendly Neighborhood With Low Population Density, Close To Parks, Schools, Shopping, And Minutes To The Freeway And Hwy. Beautiful Semi-Detached Brick Home Freshly Painted (2021) And Updated Flooring Across The Home, New Windows Throughout The Home. Spacious Kitchen. Second Floor With Three Bed Rooms. Side Entrance To Basement For Possible In-Law Suit With One Bed Room Washroom. Entrace From Garage. Upgrades In**** EXTRAS **** Fridge, Stove, Microwave, Dishwasher, Washer, Dryer, Water Softener, Electric Light Fixtures, Seller Will Replace The Stove And Dishwasher With Similar Quality New One (28016771)","2","4 + 1",,"House",,"30 YAGER AVE|Kitchener, Ontario N2M4N1","-80.4947362","43.4275434","N2M4N1",,"$600,000 ","Single Family","3","Freehold",,,"N/A (Finished)","Forced air (Natural gas)","36.88 x 117 FT ; 36.00 X 117.37","Hospital, Park, Public Transit, Schools","$2,528.85",,"https://cdn.realtor.ca/listing/TS637503949734430000/reb82/highres/9/x5135679_1.jpg"
"40074987","Four Bed room and two washrooms home in a quiet family-friendly neighborhood with low population density, close to parks, schools, shopping, and minutes to the freeway and HWY. Beautiful Semi-detached brick home freshly painted (2021) and Updated flooring and steps, NEW windows throughout the home. spacious kitchen. Second floor with three bed rooms. Side entrance to basement for possible in-law suite (partial finished). Entrance from garage. Upgrades in last 5-6 years include: Roof with gutters and soffit, all new windows, Furnace, air conditioner list is long, see it to believe it! Seller will replace dishwasher and stove with similar quality. https://youriguide.com/30_yager_ave_kitchener_on/ (62952042)","2","4 + 1","1500.0000","House",,"30 YAGER AVENUE Avenue|Kitchener, Ontario N2M4N1","-80.49454737","43.42752804","N2M4N1",,"$600,000 ","Single Family",,"Freehold","Dishwasher, Dryer, Refrigerator, Stove, Washer",,"Full (Partially finished)","Forced air, (Natural gas)","under 1/2 acre","Park, Public Transit, Schools, Shopping",,"Residential","https://cdn.realtor.ca/listing/TS637503611482770000/reb85/highres/7/40074987_1.jpg"
"X5130043","Great For Investors Or A Single Family, This 3+2 Br Home With Basement, The Main Floor Offers A Bright Living & Dining Room And Updated Kitchen, Eat In Kitchen With W/O To Deck, Big Master And 2 Good Sized Bedrooms, Full Bath & Laundry, Sep. Entrance To An In-Law Suite W/Oversized Windows Is Bright And Spacious, With 2 Br, 3-Piece Bath, Large Liv & Din Room, Kitchen And Sep. Laundry, Large Driveway For 4 Vehicles**** EXTRAS **** Two Fridges, Stove, B/I Dishwasher, B/I Microwave, Two Washers,Two Dryers, All Electrical Light Fixtures, And Garage Door Opener With Remote. (27993655)","2","3 + 2",,"House",,"103 MONTANA CRES|Kitchener, Ontario N2N2R9","-80.5382238","43.4258053","N2N2R9",,"$749,900 ","Single Family","5","Freehold",,,"N/A","Forced air (Natural gas)","40 x 100 FT",,"$3,496.42",,"https://cdn.realtor.ca/listing/TS637500098293670000/reb82/highres/3/x5130043_1.jpg"
"40073179","Great For Investors Or A Single Family, This 3+2 Br Home With Basement, The Main  Floor Offers A Bright Living & Dining Room And Updated Kitchen, Eat In Kitchen With W/O To Deck, Big Master And 2 Good Sized Bedrooms, Full Bath & Laundry, Sep.  Entrance To An In-Law Suite W/Oversized Windows Is Bright And Spacious, With 2 Br, 3-Piece Bath, Large Liv & Din Room, Kitchen And Sep. Laundry, Large Driveway For 4 Vehicles Two Fridges, Stove, B/I Dishwasher, B/I Microwave, Two Washers,Two Dryers, All Electrical Light Fixtures, And Garage Door Opener With Remote. (62936211)","2","3 + 2","1500.0000","House",,"103 MONTANA Crescent|Kitchener, Ontario N2N2R9","-80.53762299","43.42613726","N2N2R9",,"$749,900 ","Single Family",,"Freehold","Dishwasher, Dryer, Refrigerator, Stove, Microwave Built-in",,"Full (Finished)","Forced air, (Natural gas)","under 1/2 acre","Hospital, Park, Public Transit, Schools, Shopping",,"Residential","https://cdn.realtor.ca/listing/TS637499693647030000/reb85/highres/9/40073179_1.jpg"
"40070689","Beautifully renovated!! Duplex potential!! This recently updated 2 bedroom, 1.5 bathroom home offers versatility and style. It sits on a 48 x 105 lot and has a separate side door entry to the basement with an R6 zoning designation and development potential. It features a main floor bedroom and four piece bathroom. The eat-in kitchen is contemporary and fully updated with soft close mechanisms with 3 appliances, and glass backsplash. The house is carpet free with a combination of hardwood and tile flooring throughout. The second bedroom is on the upper level in addition to a two piece bathroom and laundry. Additional updates include; roof, furnace, AC, Siding, electrical panel. Dont miss out!! (62927633)","2","2 + 0",,"House",,"680 VICTORIA Street S|Kitchener, Ontario N2M3B3","-80.52034168","43.43991092","N2M3B3",,"$699,000 ","Single Family",,"Freehold","Dishwasher, Dryer, Refrigerator, Stove, Water softener, Washer",,"Full (Partially finished)","Forced air, (Natural gas)","under 1/2 acre","Hospital, Park, Place of Worship, Public Transit, Schools, Shopping",,"RES","https://cdn.realtor.ca/listing/TS637502766379470000/reb16/highres/9/40070689_1.jpg"
"40071413","A wonderful opportunity to live and work within steps of the heart of DTK!  This two-and-a-half storey duplex with CR1 zoning fronts onto Frederick Street and sits astride the highly desirable central Kitchener neighbourhoods of the East Ward and Civic Centre.  It could also easily be converted back to a single family home if one so desires! The over 1,880 square feet above-grade (plus finished basement) offers bountiful space for a main floor business, with the two bedroom upper unit also featuring open concept living space, with a nicely sized kitchen, walkout balcony and finished attic space.  Great for a small business or professional corporation, with the added advantage of being able to either live above the shop yourself, or find a residential tenant for added income!  Theres more than enough room for two large separate offices on the main level, plus a back den for admin assistance and even potential for a third office downstairs.  A bonus kitchenette is featured on the main level.  This property is only a few minutes from the expressway for ease of access, 10 minutes on foot to the regional courthouse, and just 15 minutes by foot to the central DTK intersection of King and Queen.  Call or click today for more information! (62918776)","2","2 + 0","1884.2100","House",,"310 FREDERICK Street|Kitchener, Ontario N2H2N7","-80.4770502","43.45643312","N2H2N7",,"$699,900 ","Single Family",,"Freehold","Dryer, Microwave, Refrigerator, Stove, Washer",,"Full (Partially finished)","Forced air","under 1/2 acre","Hospital, Park, Place of Worship, Playground, Public Transit, Schools",,"CR1","https://cdn.realtor.ca/listing/TS637497109035500000/reb16/highres/3/40071413_1.jpg"
"40067799","ATTENTION savvy investors and home owners! Get this 2015 built semi-detached property with in-law suite in desirable Rockway! This is in an IDEAL location downtown Kitchener. This property is currently being ran as a VERY profitable AirBnB and is fully furnished, decorated and fully operating. You could simply move right in with all the furniture if youd like, fully turn key, or you can buy it without the furnishings. The seller is a very successful investor with AirBnb properties in KWC and is willing to stay on as a property manager and continue running this gem for you! With a 7.3% cap rate, wow, youll never find this in KWC for a property in this price range. Move in and enjoy the home, continue renting 1 unit as a mortgage helper, or go all the way and be a savvy investor and continue renting the entire property. (62893821)","3","3 + 1","1500.0000","House",,"447 STIRLING Avenue S|Kitchener, Ontario N2M3H7","-80.49017","43.436203","N2M3H7",,"$749,900 ","Single Family",,"Freehold","Dishwasher, Dryer, Refrigerator, Stove, Washer",,"Full (Finished)","Forced air","under 1/2 acre",,,"res","https://cdn.realtor.ca/listing/TS637491686863900000/reb20/highres/9/40067799_1.jpg"
"40085013","Welcome to 213 Templewood Dr Kitchener! Gorgeous carpet free freehold townhouse (NO  FEES ), 3- Bedroom 3-bathroom, single car garage, bright end Unit, Walkout  basement,  located in Huron Park! Master bedroom 3pc ensuite; stainless kitchen appliances;  Spacious living room, sliding doors to the deck and fenced yard. Close to amenities and 401  access yet quiet family friendly area close to parks/schools. Brand new laminate flooring,  Fresh painting, Updated bathrooms and kitchen (2021), new quartz counter top and toilets  installed(2021). New dishwasher installed (2021). Better than new! A Must See! (63046030)","3","3 + 0","1224.0000","Row / Townhouse",,"213 TEMPLEWOOD Drive|Kitchener, Ontario N2R0A3","-80.46388284","43.39463622","N2R0A3",,"$619,900 ","Single Family","2","Freehold","Dishwasher, Dryer, Refrigerator, Stove, Water softener, Washer, Microwave Built-in, Hood Fan",,"Full (Unfinished)","Forced air, (Natural gas)","under 1/2 acre","Park, Playground, Public Transit, Schools",,"Residential","https://cdn.realtor.ca/listing/TS637520151560300000/reb16/highres/3/40085013_1.jpg"
"40070227","Welcome to the move-in ready end-unit townhome in desirable Williamsburg neighborhood in Kitchener! You will find yourself in the immaculate home as you enter the property with no carper -except on stairs. The main floor with beautiful custom floor, shiplap fireplace (electric  2019) in the main living area; open concept granite countertops, catchy backsplash and all stainless appliances including Double Oven Stove in the kitchen. A Bright Kitchen with Dinette and Walk out onto the 16 x 22 ft. deck featuring an eating area, built in benches/planter boxes, and natural gas hook ups with pergola. Fully fenced backyard recently updated! Upstairs youll find a bonus loft office space, a large master, 2 additional bedrooms and a 3pc bathroom. Updated light fixtures on the main floor and over-sized single car garage are included in the features of this beautiful home. Walking distance to shopping, schools, parks and Goodlife Fitness, with easy access to area highways and 401. Dont miss this opportunity in a family friendly neighborhood! Book or call for your private viewing. This property won't last long! (63029865)","2","3 + 0","1320.0000","Row / Townhouse",,"138 DUBRICK Crescent|Kitchener, Ontario N2E4G3","-80.504568","43.404557","N2E4G3",,"$649,900 ","Single Family","3","Freehold","Dishwasher, Dryer, Refrigerator, Stove, Washer, Microwave Built-in, Window Coverings",,"Full (Unfinished)","Forced air, (Natural gas)","under 1/2 acre","Park, Place of Worship, Playground, Public Transit, Schools, Shopping",,"Residental","https://cdn.realtor.ca/listing/TS637519695318200000/reb16/highres/7/40070227_1.jpg"
"40084480","Quality built Energy efficient, Energy Star freehold property by Fusion Homes. Private maintenance free landscape backing onto forested greenbelt and rock wall. Enjoy nature from your window or from Grand Rivers walking trails minutes away. Bright open concept main floor offers kitchen with peninsula breakfast bar and sliding glass doors to backyard. Master bedroom features ensuite and walk-in closet. Many updates include A/C 2017, Driveway 2018, Dishwasher 2019, Toilets 2019, Dryer 2019, Washer 2021, Blinds 2019, Professional finished basement 2020 with cold room and 3 piece rough-in. Oversized single garage with garage door opener, Low E windows, energy saving features throughout. NO CONDO FEES or MAINTENANCE fees. Easy access to highway 24 (and 401), Guelph and the Waterloo Regional Airport! (63044015)","3","3 + 0","1490.0000","Row / Townhouse",,"127 UPPER MERCER Street|Kitchener, Ontario N2A4N2","-80.404379","43.445827","N2A4N2",,"$625,000 ","Single Family","3","Freehold","Dishwasher, Dryer, Refrigerator, Stove, Washer, Hood Fan",,"Full (Partially finished)","Forced air, (Natural gas)","under 1/2 acre",,,"RES","https://cdn.realtor.ca/listing/TS637519569311300000/reb16/highres/0/40084480_1.jpg"
"40084295","Executive Townhome Condo located in a mature part of Kitchener. This 1,480 sq/ft freehold townhome is close to Conestoga College, walking trails to Walter Bean Trail and Schneider's Creek and is only 5 minute drive to the 401! This townhome has many upgrades including: hardwood floors and railings, r/o water system, natural gas bbq, insulation in attic in 2019 and glass tile backsplash in the kitchen with upgraded appliances! Upstairs has a full width master bedroom including an ensuite with a walk in ceramic tiled and glass door shower. Second bedroom is also a great size with the 4 pc bath next door and the awesome feature of a laundry closet. No need to take clothes down the stairs!! Main floor has a walk out to a deck and open quiet space and a 2pc wash located near the entrance. Lower level is fully finished and could be used as a den or bedroom! Lower level also has a bathroom rough in!. You will love the open space with natural sunlight! Schedule your viewing today! (63039291)","3","2 + 1",,"Row / Townhouse",,"105 PINNACLE Drive Unit# 29|Kitchener, Ontario N2P1B8","-80.41556302","43.39028223","N2P1B8",,"$629,900 ","Single Family",,"Condominium","Central Vacuum, Water softener",,"Full (Finished)","Forced air",,"Golf Nearby, Place of Worship, Public Transit, Shopping",,"Residential","https://cdn.realtor.ca/listing/TS637517695789000000/reb41/highres/5/40084295_1.jpg"
"40084216","You've found your perfectly-located property in desirable Lackner Woods. Get ready to call this 3 bedroom 3 bath freehold townhouse home. It's located near two schools, Chicopee Ski Hill, trails winding toward the nearby Grand River, highways 401 & 85. All this while backing onto greenspace (no backyard neighbours) The main floor boasts an appealing open concept layout with ceramic tile and main floor laundry. Upstairs features a very spacious master with 4 piece ensuite. Step out the sliding floors from the great room to your patio and fenced yard where you can hear the birds in the adjacent green space. Investors, this house has a new roof (2019) and furnace (2017) with no condo fees! Book your visit today,  this beauty won't last long! (63038758)","3","3 + 0",,"Row / Townhouse",,"78 COLTON Circle|Kitchener, Ontario N2A4K4","-80.40909736","43.44801779","N2A4K4",,"$574,900 ","Single Family","2","Freehold","Dryer, Microwave, Refrigerator, Stove, Washer, Gas stove(s), Hood Fan",,"Full (Unfinished)","Forced air, (Natural gas)","under 1/2 acre","Airport, Golf Nearby, Hospital, Park, Place of Worship, Playground, Public Transit, Schools, Shopping, Ski area",,"RES","https://cdn.realtor.ca/listing/TS637517643638900000/reb16/highres/6/40084216_1.jpg"
"40083153","You can stop your search immediately. NO CONDO FEES, this townhome boasts purely impressive features. Maple hardwood and ceramic flooring on the main floor, carpet upstairs (New2020), deep soaker tub plus custom glass designer tile in upper bathroom, maple railings and upper & lower decks! Completed with a fully finished basement that includes a beautiful 3 piece washroom, massive rec room which has a walkout into the private, fully fenced, landscaped backyard. Located in the much sought after Idlewood/Lackner Woods neighborhood, you need to book a showing ASAP. (63035511)","3","3 + 0","1386.1000","Row / Townhouse",,"919 ZELLER Crescent|Kitchener, Ontario N2A0C7","-80.41026599","43.45386223","N2A0C7",,"$600,000 ","Single Family","2","Freehold","Dishwasher, Dryer, Refrigerator, Water softener, Washer, Gas stove(s)",,"Full (Finished)","Forced air","under 1/2 acre","Park",,"R","https://cdn.realtor.ca/listing/TS637518468676270000/reb16/highres/3/40083153_1.jpg"
