MlsNumber,PublicRemarks,Bathrooms,Bedrooms,InteriorSize,Type,Ammenities,Address,Longitude,Latitude,PostalCode,NeighbourHood,Price,PropertyType,ParkingSpace,OwnershipType,Appliances,FlooringType,BasementType,HeatingType,LandSize,AmmenitiesNearBy,PropertyTax,ZoningDescription,LowResPhoto
"X5162159","Circa 1884 Classic Yellow Brick Farmhouse. Ready To Move In Or Renovate To Suite Your Taste. Lots Of Characteristics & Potentials. Featuring Kitchen W/ Breakfast Area & Laundry Set, 4 Bedrooms, 2 Bathrooms, 2F Balcony, Deck & Storage Shed (As Is) In Backyard, And 4+ Driveway Parking. Walk To Lrt, Amenities, Parks, Hospitals, Tech Innovation District, And Go Station Direct W/ Train To Toronto. 30 Mins Walking To Uptown Waterloo Bia. East Access Hwys.**** EXTRAS **** Buyer Arrange Home Inspection. Wiring 2012. 2F Bath & Roof 2014. Furnace & Ac 2015. Gf Bath, Windows, Kitchen & Ss Appliances 2016. Water Purifier & Softener, Laundry Are Unknown. No Under Contract Items. Property & Fixtures Are Sold As Is. (28125759)","2","4",,"House",,"110 WILHELM ST|Kitchener, Ontario N2H5S4","-80.4942108","43.460235","N2H5S4",,"$699,000 ","Single Family",,"Freehold",,,"Full (Unfinished)","Forced air (Natural gas)","50.4 x 119.43 FT ; 78.48 X 122.36 X 51.18 X 119.43","Hospital, Park, Public Transit, Schools","$3,683.30",,"https://cdn.realtor.ca/listing/TS637520329049000000/reb82/highres/9/x5162159_1.jpg"
"X5162361","The Perfect Family Home. Pride Of Ownership & Upgraded Over The Years. Beautifully Renovated Kitchen, Bright Dining And Living Room, 3 Bedrooms - All On The Main Level. The Master Bedroom Features An Ensuite 2-Piece. A Super-Size Lower Level With Two Walkouts To The Backyard. Large Family Room Perfect For Movie Nights And Features A Patio Door Walkout To A Sunny, Large Deck. Lower Workshop, Office, & Washroom. Lg Corner Lot, Schools, Shops, Hwy!**** EXTRAS **** Large Corner Lot, Close To Schools, Transit, Hwy Access. Home Has Been Maintained Throughout The Ownership. Includes Existing Fridge, Stove, Dishwasher, Laundry Machines, Window Covers, Both Garden Sheds & Antique Organ In Family Room. (28125983)","3","3",,"House",,"6 PINEDALE DR|Kitchener, Ontario N2E1J7","-80.5041411","43.4197915","N2E1J7",,"$599,900 ","Single Family",,"Freehold",,,"Full (Finished)","Forced air (Natural gas)","63.56 x 100.16 FT","Park, Public Transit, Schools","$3,067.60",,"https://cdn.realtor.ca/listing/TS637520329607700000/reb82/highres/1/x5162361_1.jpg"
"40082085","BEAUTIFUL BUNGALOW WITH A RUSTIC FEEL IN THE CITY!! Welcome to 43 Jack Ave. Located within walking distance of Victoria Park and Belmont Village. This charming detached carpet-free bungalow is move-in ready and great for first-time home buyers. Upon entering the home, you walk into the living room with a large window and a showstopper of an accent wall. The main floor also includes a 4pc bathroom and 2 good-sized bedrooms including a master bedroom with a walk-in closet. Walking a little further into the home you have a dining room with beautiful exposed wood beams and sliding door to access the large backyard. The kitchen includes stainless steel appliances with white cabinetry and white waterfall countertops. The basement is fully finished with durable epoxy floors which include a large recreational room for extra living space, 5pc bathroom, spare bedroom, office, and another kitchen. Lastly, the fully fenced backyard features a new concreate pad and shed (2020). Full reno upstairs and downstairs (2019). 3+ car deep driveway. Updated ventilation in bathrooms (2019). Fully licensed and commercial kitchen with proper zoning in the basement. Minutes from St. Marys Hospital, Victoria Park, Downtown Kitchener, and schools. Book your private showing today! (63044444)","2","2 + 1","1010.9900","House",,"43 JACK Avenue|Kitchener, Ontario N2M1Z9","-80.50997927","43.44268073","N2M1Z9",,"$599,000 ","Single Family","4","Freehold","Dishwasher, Dryer, Refrigerator, Stove, Washer",,"Full (Finished)","Forced air, (Natural gas)","0.144 ac|under 1/2 acre","Hospital, Park, Public Transit, Schools",,"RES","https://cdn.realtor.ca/listing/TS637520222961570000/reb20/highres/5/40082085_1.jpg"
"40082265","ATTENTION COMMUTERS! LOCATION! Welcome to 369 Thomas Slee Dr. This beautiful detached 2 storey home is move-in ready and finished top to bottom. Enter into the large front foyer which leads you to the 2pc powder room and carpet-free main living area. The living room/dining room has elevated ceilings making the space very roomy, a window to allow in natural light and sliding doors that gives you access to the backyard. Talk about open-concept and clear sightlines! The kitchen is open to the living/dining room and has stainless steel appliances, a double sink with a window and lots of cabinetry for storage. Upstairs features a 4pc bathroom and 3 spacious bedrooms including a master bedroom with a 4pc ensuite and walk-in closet. The basement is fully finished with a 3pc bathroom and a large recreational room for additional living space. Lastly, the backyard has a stone patio set where you can enjoy relaxing on those nice summer afternoons with greenery in the back for added privacy from your rear neighbours. Minutes from schools, parks, trails, Rec Centre and HWY 401. Book your private showing today! (63044620)","4","3 + 0","1552.6000","House",,"369 THOMAS SLEE Drive|Kitchener, Ontario N2P2X5","-80.43373637","43.37484378","N2P2X5",,"$749,900 ","Single Family","3","Freehold","Dishwasher, Dryer, Microwave, Refrigerator, Stove, Water softener, Washer",,"Full (Finished)","Forced air, (Natural gas)","0.091 ac|under 1/2 acre","Park, Schools",,"RES","https://cdn.realtor.ca/listing/TS637520222950930000/reb20/highres/5/40082265_1.jpg"
"40084934","Location, Location, Location! This move-in ready, fully updated, cozy, warm Bungalow has lots of potentials to offer and waiting for you! Freshly painted main floor with updated kitchen, bathroom, and hardwood floor throughout! Big, clean basement with plenty of space (bedroom+full bathroom+recreation room) and a Separate Entrance which gives you an income potential! The big, Spacious backyard offers you to be creative and have an addition to the current building and turn it into a big,2-story with 3400sqft (total living space including basement). The engineer development plan (drawing) is ready for the next lucky owner! An easy walk to Schools, the University of Waterloo and Wilfrid Laurier University, College Campus, Parks, Trails, Shopping centers, on Public Transportation route and commuting made simple with the Expressway nearby.  Don't lose this opportunity and book your private showing today! (63045702)","2","2 + 1",,"House",,"459 BRIDGEPORT Road|Kitchener, Ontario N2K1N8","-80.48935231","43.47483802","N2K1N8",,"$699,900 ","Single Family",,"Freehold","Central Vacuum, Dishwasher, Dryer, Refrigerator, Stove, Water softener, Washer, Microwave Built-in",,"Full (Finished)","Forced air","under 1/2 acre","Place of Worship, Public Transit, Schools, Shopping",,"R3","https://cdn.realtor.ca/listing/TS637520263052070000/reb16/highres/4/40084934_1.jpg"
"40084765","Welcome to 38 Carlyle Place. Located at the top of the circle on this quiet court. A great place to raise little ones and enjoy a great neighborhood. Three good sized bedrooms and two bathrooms, recently updated kitchen and newer windows (2012). The pie shaped lot allows plenty of room for backyard entertaining, gardening and birdwatching. (63044811)","2","3 + 0",,"House",,"38 CARLYLE Place|Kitchener, Ontario N2P1R6","-80.45407022","43.39399927","N2P1R6",,"$560,000 ","Single Family",,"Freehold","Dryer, Microwave, Refrigerator, Stove, Water softener, Washer, Window Coverings",,"Full (Finished)","Forced air, (Natural gas)","under 1/2 acre","Public Transit, Schools, Shopping",,"RES","https://cdn.realtor.ca/listing/TS637520053267370000/reb16/highres/5/40084765_1.jpg"
"40084724","Welcome to 79 The Country Way located in the Country Hills area of Kitchener. This backsplit is a Werner Bromberg build circa 1985. Much of the original character remains but with a vision and some updates this gem will shine again. This 4 level backsplit has a main floor consisting of a living room with french doors, dining room and a large eat-in kitchen with a slider to an outside deck. The upper level has 3 bedrooms and a 4 piece bathroom. The lower level has a large family room with gas fireplace and a slider to the rear yard it also features a 3 piece bath. The basement consists of a rec room, cold cellar and a utility room with laundry provisions. Call now for your private showing ! (63044258)","2","3 + 0",,"House",,"79 THE COUNTRY Way|Kitchener, Ontario N2E2K3","-80.47808759","43.412031","N2E2K3",,"$550,000 ","Single Family","3","Freehold","Central Vacuum, Dishwasher, Dryer, Refrigerator, Stove, Water softener, Washer, Window Coverings",,"Full (Partially finished)","Forced air, (Natural gas)","under 1/2 acre","Park, Place of Worship, Public Transit, Schools, Shopping",,"Residential","https://cdn.realtor.ca/listing/TS637519569306000000/reb16/highres/4/40084724_1.jpg"
"40083831","EXCEPTIONAL SEMI!  Spacious 4 bedroom, 3 bathroom semi-detached home. Room to play and garden on a fenced 180 ft. deep lot! Open concept living and dining room with hardwood floors. Spacious kitchen with dinette and sliding doors to stamped concrete patio & fully-fenced yard. Newly finished basement with rec room, laundry and deluxe 4 piece bathroom. Single garage and driveway parking for 4 vehicles. Family-friendly Country hills neighbourhood, close to parks, schools, shopping & convenient highway access. (63042669)","3","4 + 0","1556.0000","House",,"50 JOSHUA Street|Kitchener, Ontario N2C2T4","-80.46475133","43.41685804","N2C2T4",,"$649,000 ","Single Family","5","Freehold","Dishwasher, Dryer, Refrigerator, Water softener, Washer, Microwave Built-in",,"Full (Finished)","Forced air, (Natural gas)","under 1/2 acre","Park, Public Transit, Schools",,"RESIDENTAL","https://cdn.realtor.ca/listing/TS637519119189530000/reb16/highres/1/40083831_1.jpg"
"X5160400","Sought After Neighborhood Of Country Hills, Sits This 3+1 Bedroom Family Home Offering A Huge Potential For An In-Law Setup Or Mortgage Helper In The Walkout Basement. With Walking Trails, Parks, Many Amenities Nearby, Close Proximity To Conestoga College & Access To The 401, Don't Pass Up This Opportunity! (28117305)","3","3 + 1",,"House",,"235 SOUTHWOOD DR|Kitchener, Ontario N2E2B2","-80.4680714","43.4092926","N2E2B2",,"$624,888 ","Single Family","2","Freehold",,,"N/A (Finished)","Forced air (Natural gas)","35.47 x 114 FT","Public Transit, Schools","$4,167",,"https://cdn.realtor.ca/listing/TS637518227311930000/reb86/highres/0/x5160400_1.jpg"
"40084440","Amazing investment opportunity in a sought after neighbourhood! All brick raised bungalow with full in law suite. This home can easily be converted into a duplex and the large majority of the construction for a duplex has been done already. (It is missing a fire rated door and the application process plus associated fees). This lovely dwelling sits on a lot that is 122 feet deep and has 4 bedrooms, 2 bathrooms and 2 kitchens. All appliances are included. Upgrades include a new 22x30 foot deck(2020); New water softener(2020). The home also boasts two gas fireplaces, California shutters. The kitchen has solid wood cabinets with an island that opens up the the spacious living room. Just a hop and a skip away from the Boardwalk and all its amenities. (63041025)","2","3 + 0","1965.0000","House",,"55 WILDLARK Crescent|Waterloo, Ontario N2N3E9","-80.53884884","43.43161373","N2N3E9",,"$719,000 ","Single Family","3","Freehold","Dishwasher",,"Full (Finished)","Forced air","under 1/2 acre",,,"RES","https://cdn.realtor.ca/listing/TS637517859221730000/reb16/highres/0/40084440_1.jpg"
"X5159246","3 Bed Room Detached In Forest Heights On A Deep Lot At The End Of A Quiet Cul-De-Sac Backing Onto A Wooded Trail. Tastefully Updated With Trendy Finishes. Main Floor With Large Bay Windows, Living And Family Room Space And An Updated Eat-In Kitchen With Newer Cabinets (2013) Stainless Steel Appliances (2019). Basement Is Home To A Large Rec Room With Floor To Ceiling Built-In Oak Shelving And Gas Fireplace. Perfect For First Time Buyers And Young Families!**** EXTRAS **** Stove, Fridge, Dishwasher, Microwave Vent, Washer & Dryer Water Heater Is Rented (28113725)","2","3",,"House",,"99 ROYAL ORCHARD PL|Kitchener, Ontario N2N1Z6","-80.5274144","43.415125","N2N1Z6",,"$649,000 ","Single Family","3","Freehold",,,"N/A (Finished)","Forced air (Natural gas)","42.75 x 115 FT",,"$3,188",,"https://cdn.realtor.ca/listing/TS637517639284930000/reb82/highres/6/x5159246_1.jpg"
"40084334","Opportunity knocks on this unique midtown property!  Currently being used as 2 side by side units, each a full 2 storey unit with a full basement.  The main unit is a 3 bedroom 2 bath unit and the 2nd unit 46A is a 2 bedroom 1 bath unit.  If you're looking for a property with a mortgage helper or maybe an investment.  Also a great opportunity to do some work here and turn it back into a large family home with a large yard.  Located within walking distance to an LRT stop, Grand River Hospital and Google, this is a rare chance to get creative and maybe buy with another friend who is looking to get into the market but you don't need to live in the same space with them!  Please make sure to review photos and virtual tour before booking a showing. (63039021)","3","5 + 0","2108.0000","House",,"46 SHANLEY Street|Kitchener, Ontario N2H5N9","-80.50330903","43.45636082","N2H5N9",,"$599,900 ","Single Family","5","Freehold","Dryer, Refrigerator, Stove, Washer",,"Full (Unfinished)","Forced air, (Natural gas)","under 1/2 acre","Hospital, Place of Worship, Public Transit, Schools, Shopping",,"residential","https://cdn.realtor.ca/listing/TS637517661905400000/reb16/highres/4/40084334_1.jpg"
"40081704","City-approved, turn-key, duplexed bungalow in desirable Forest Heights beckons for your immediate attention!   Has the cost of living in KW gotten you down?  Search no longer - 77 Elm Ridge is your solution.  Enjoy quality of life in the three bedroom main unit while receiving $1399 a month mortgage helper income from the lower unit.  Both tenants are on month-to-month basis with main unit tenant departing prior to May 1.  (Main unit tenant is currently paying $1900 per month and has garage access.) The main unit features an updated, Eurostyle Oxford white kitchen with extensive cabinetry accentuated with subway tile backsplash.  Kitchen and bathroom flooring upgraded to vinyl plank.  The living room/dining area has hardwood flooring and the three bedrooms have beautiful re-finished and stained parquet flooring.  Newer toilet and sink in main bath. The spacious lower unit features a modern IKEA kitchen, large living central living room, two bedrooms and a den.  Bedrooms and den feature newer laminate plank flooring. Both units are carpet-free and have in suite laundry. Note composite front porch with black aluminum railing, newer side deck fully fenced backyard. This is a smart acquisition for buyer looking to offset housing costs or buyer seeking multi-generational home or investor looking for a foothold in one of the best real estate/rental markets in Canada! (63035410)","2","3 + 2","1121.0000","House",,"77 ELM RIDGE Drive|Kitchener, Ontario N2N1G5","-80.52456021","43.42313221","N2N1G5",,"$624,900 ","Single Family","3","Freehold","Dishwasher, Dryer, Refrigerator, Stove, Washer, Hood Fan",,"Full (Finished)","Forced air, (Natural gas)","0.107 ac|under 1/2 acre","Public Transit",,"R4","https://cdn.realtor.ca/listing/TS637517625792900000/reb16/highres/4/40081704_1.jpg"
"X5158972","Opportunity Knocks! Rare Find In This Neighbourhood As This Home Boasts Four Bedrooms (All On The Same Level), 3 Baths And A Double Garage! The Backyard Features A Gorgeous Patio Area, In-Ground Pool, And Still Room For Plenty Of Grass Space. Walk Into This Lovely Home Through A Peaceful Front Patio And Into The Updated Foyer With New Flooring, Updated 2 Pc Washroom And Updated Family Room With A Gas Fireplace. (28112083)","3","4",,"House",,"36 GAY CRES|Kitchener, Ontario N2A2C3","-80.4385412","43.4475424","N2A2C3",,"$700,000 ","Single Family","4","Freehold",,,"Full (Finished)","Forced air (Natural gas)","58 x 130 FT","Public Transit, Schools","$4,321.02",,"https://cdn.realtor.ca/listing/TS637517579370700000/reb86/highres/2/x5158972_1.jpg"
"40083822","Recently updated 3 bedroom, 3 bathroom in east Kitchener, close to the Grand River & expressway! Brand new flooring on the main level.  Main floor powder room. Kitchen with new stainless appliances. Finished lower level with rec room and 3 piece bath. Brand new furnace and central air. Fully fenced yard. Just move-in! (63036761)","3","3 + 0","1362.0000","House",,"279 TAGGE Crescent|Kitchener, Ontario N2K3R7","-80.47029535","43.47952507","N2K3R7",,"$675,000 ","Single Family","5","Freehold","Dishwasher, Dryer, Refrigerator, Stove, Washer, Hood Fan",,"Full (Finished)","Forced air, (Natural gas)","under 1/2 acre","Park, Place of Worship, Public Transit, Schools, Shopping",,"RESIDENTAL","https://cdn.realtor.ca/listing/TS637517559485870000/reb16/highres/2/40083822_1.jpg"
"40084087","Opportunity!Whether You're Looking To Expand Your Investment Portfolio Or Need More Spacious Home For Your Growing Family,This Fully Detached Home Offers Both,With Over 2381 Sq/Ft Of Finished Living Space,Consisting Of Living Dinning ,Kitchen 8 Bedrooms And 3 Baths,Want To Spend The Warm,Sunny Days By The Pool,Tanning On The Deck: Only Two Minutes Drive From The 401 And Extremely Close To Public Transit,Conestoga College And Shopping A Very Short Walk Away.What Are You Waiting For?? All dimensions are taken from the I guide source. Basement has a pantry that can be used as kitchen after getting permit from city. (63036513)","3","6 + 1","1704.0000","House",,"78 AMHERST Drive|Kitchener, Ontario N2P1C9","-80.41130933","43.39247269","N2P1C9",,"$729,000 ","Single Family",,"Freehold","Dryer, Refrigerator, Stove, Washer",,"Full (Finished)","Forced air","under 1/2 acre","Public Transit, Schools",,"R3","https://cdn.realtor.ca/listing/TS637517523354000000/reb16/highres/7/40084087_1.jpg"
"40082614","So Cute! So Cozy! So Available!  We are pleased to offer this exceptionally well cared for, well appointed 4 bedroom bungalow located in the desireable West ward area of Kitchener.  Located next to miles of well maintained trails, Famed Victoria Park is just steps away!  Built in 1954 at a time when builders took pride in their workmanship, these owners have been fantastic stewards for the property, updating it with an Artistic and attractive flair over the years.  Impressive new Concrete driveway with parking for up to 8 cars leads to a fully bricked detached double car garage perfect for parking out of the elements, or that dream workshop you have always deserved. Great curb appeal with the Armour stone accents featured along the front of the property as well as the built up, low maintenance flower beds.  Attention to detail and uniqueness is displayed throughout the main floor living area that features 3 bedrooms, living room and an Eat in Kitchen area featuring oodles of cabinet space.  A not to miss on this main floor is the access hatch to the upper walk up untouched attic space awaiting your design touches! The basement area is sure to impress with ALL areas exquisitly finished from the laundry to the 4 piece extra bath to oversize rec room!  Out the back, nature lovers will love the peace and serenity that this 200+ Foot property has to offer.  A little country in the city with areas for raised gardens, reading/sitting/entertaining gazebo as well as play areas set up for the kids! Some important noteables Furnace 2013, Air conditioner 2015, roof 2019, water softener 2018, Concrete driveway 2018, Composite Deck 2019, All windows newer vinyl clad and R60 insulation in the attic! (63034973)","2","3 + 1","1020.0000","House",,"152 PATRICIA Avenue|Kitchener, Ontario N2M1J6","-80.50588931","43.44151605","N2M1J6",,"$599,900 ","Single Family",,"Freehold","Dishwasher, Dryer, Refrigerator, Stove, Water softener, Washer, Hot Tub",,"Full (Finished)","Forced air, (Natural gas)","under 1/2 acre","Hospital, Playground, Public Transit, Schools, Shopping",,"RES","https://cdn.realtor.ca/listing/TS637517517877000000/reb16/highres/4/40082614_1.jpg"
"40084016","Welcome to 105 Sims Estate! Sitting at the base of Chicopee Ski Club this stunning Semi Detached home is over 1600 sq ft. The main floor is Open Concept and has new engineered flooring with a  kitchen that features stainless appliances, quartz surfaces and breakfast island. There is also separate dining  and walk out through  over sized sliders to fully fenced back yard. Just upstairs there is an extra loft area that will work great for an office. The huge Master Bedroom with cathedral ceiling has a impressive walk in closet and ensuite privilege. The upstairs level is complete with 2 more large bedrooms and family bath Out back the custom  deck is perfect for entertaining with gas hook up for your BBQ. The newer built  garden shed will come in handy for storage. The basement level is unspoiled and awaits your design.   Close to all amenities the region has to offer and just steps to skiing, tennis, community trails and so much more. We invite you to come for a viewing! (63036100)","2","3 + 0",,"House",,"105 SIMS ESTATE Drive|Kitchener, Ontario N2A0A9","-80.4196219","43.4387012","N2A0A9",,"$649,900 ","Single Family","2","Freehold","Dishwasher, Dryer, Refrigerator, Stove, Washer, Microwave Built-in, Hood Fan, Window Coverings",,"Full (Unfinished)","Forced air","under 1/2 acre","Airport, Hospital, Park, Place of Worship, Public Transit, Schools, Shopping, Ski area",,"Residential","https://cdn.realtor.ca/listing/TS637517481341300000/reb16/highres/6/40084016_1.jpg"
"40078218","Nestled in the SOUGHT AFTER neighborhood of COUNTRY HILLS, sits this 3+1 bedroom FAMILY HOME offering a HUGE POTENTIAL for an IN-LAW SETUP or MORTGAGE HELPER in the WALKOUT BASEMENT. The main floor boasts a FUNCTIONAL FLOORPLAN with the formal living room, dining room towards the front of the home adjoining an ELEGANT half bath. The bright kitchen adorns OAK CABINETRY, STAINLESS STEEL APPLIANCES & ample counter space. The dinette area offers a large GALLERY WINDOW with views of the MAJESTIC treed & fenced backyard in a LARGE PIE LOT. This level also includes a family room with a VAULTED CEILING & track lighting amidst the WOOD BURNING FIREPLACE & sliders to the deck & gazebo. The upper floor offers 3 SPACIOUS BEDROOMS including the master bedroom with double closets & a full bathroom. Did we mention CRYSTAL CHANDELIERS & CALIFORNIA SHUTTERS? Access the lower level common area with a laundry room; a SEPARATE BASEMENT AREA has been finished to include 1 bedroom, a full bath, living area & a kitchenette with a SEPARATE WALKOUT to a REAR PATIO. Complete with a single car garage & parking for 2 cars on the driveway, including a low maintenance front yard with AGGREGATE STONE surrounding landscaping & an extra-large side shed. With walking trails, parks, many amenities nearby, close proximity to Conestoga College & access to the 401, dont pass up this opportunity! (63030055)","3","3 + 1",,"House",,"235 SOUTHWOOD Drive|Kitchener, Ontario N2E2B2","-80.46843776","43.40939205","N2E2B2",,"$624,888 ","Single Family",,"Freehold","Central Vacuum, Dishwasher, Dryer, Microwave, Refrigerator, Stove, Washer, Hood Fan",,"Full (Finished)","Forced air, (Natural gas)","under 1/2 acre","Park, Public Transit, Schools, Shopping",,"RES","https://cdn.realtor.ca/listing/TS637519170847070000/reb16/highres/8/40078218_1.jpg"
"X5158559","Welcome To 28 Metzloff Avenue! Beautifully Renovated 3 Bed/3 Bath Detached Modern House That Has An Older Charm On A Tree Lined Street With A Boulevard On A Large Lot. Pool Sized Yard, Large Deck (16X12), New Storage Shed, Lots Of Space To Design An Oasis.  Parking For 4 Suvs.  Solid Brick Home With Lots Of Natural Light. Great Central Location And Lots Of Amenities Nearby.  Great Home, Great Neighbourhood And Great Neighbours!**** EXTRAS **** New Hardwood Floors Throughout.  A Washroom On Every Floor! Workshop And Wood Finishing's Throughout The Basement. Modern Kitchen With Lots Of Workspace And Storage. (28110217)","3","3",,"House",,"28 METZLOFF DR|Kitchener, Ontario N2M1Z2","-80.5076043","43.4420343","N2M1Z2",,"$599,900 ","Single Family",,"Freehold",,,"N/A (Finished)","Forced air (Natural gas)","44.03 x 122.94 FT ; 44.74 X 117.18","Hospital, Park, Public Transit, Schools","$3,089.50",,"https://cdn.realtor.ca/listing/TS637520145654670000/reb82/highres/9/x5158559_1.jpg"
